{"id":1550202704,"isReadOnly":false,"metaTags":null,"headHtml":null,"customCss":null,"headerHtml":"<section class=\"u-clearfix u-header u-palette-5-light-2 u-block-2cdd-1\" custom-posts-hash=\"T\" data-style=\"header-logo-menu-oneline\" data-post-id=\"91508071\" data-section-properties=\"{&quot;grid-spacing&quot;:&quot;0&quot;,&quot;align&quot;:&quot;left&quot;,&quot;stretch&quot;:true}\" id=\"sec-8229\" data-source=\"\" data-id=\"2cdd\">\n  <div class=\"u-align-left u-clearfix u-sheet u-block-2cdd-2\">\n    <h3 class=\"u-headline u-text u-block-2cdd-3\"><a href=\"/\">Tijuana&nbsp;</a></h3>\n    <nav class=\"u-menu u-menu-hamburger u-offcanvas u-block-2cdd-4\" data-responsive-from=\"XL\">\n      <div class=\"menu-collapse\">\n        <a class=\"u-button-style u-nav-link\" href=\"#\" style=\"padding: 4px 0px; font-size: calc(1em + 8px);\">\n          <svg class=\"u-svg-link\" preserveAspectRatio=\"xMidYMin slice\" viewBox=\"0 0 302 302\" style=\"undefined\">\n            <use xlink:href=\"#svg-a760\"></use>\n          </svg>\n          <svg xmlns=\"http://www.w3.org/2000/svg\" xmlns:xlink=\"http://www.w3.org/1999/xlink\" version=\"1.1\" id=\"svg-a760\" x=\"0px\" y=\"0px\" viewBox=\"0 0 302 302\" style=\"enable-background:new 0 0 302 302;\" xml:space=\"preserve\" class=\"u-svg-content\">\n            <g>\n              <rect y=\"36\" width=\"302\" height=\"30\"></rect>\n              <rect y=\"236\" width=\"302\" height=\"30\"></rect>\n              <rect y=\"136\" width=\"302\" height=\"30\"></rect>\n            </g>\n            <g></g>\n            <g></g>\n            <g></g>\n            <g></g>\n            <g></g>\n            <g></g>\n            <g></g>\n            <g></g>\n            <g></g>\n            <g></g>\n            <g></g>\n            <g></g>\n            <g></g>\n            <g></g>\n            <g></g>\n          </svg>\n        </a>\n      </div>\n      <div class=\"u-nav-container\">\n        <ul class=\"u-nav u-spacing-25 u-unstyled u-block-2cdd-9\"><li class=\"u-nav-item\"><a class=\"u-button-style u-nav-link\" href=\"Casa.html\" data-page-id=\"122998333\" style=\"padding: 8px 0px;\">Casa</a><div class=\"fake u-nav-popup u-block-2cdd-10\"><ul class=\"u-h-spacing-20 u-nav u-unstyled u-v-spacing-10 u-block-2cdd-11\"><li class=\"u-nav-item\"><a class=\"u-button-style u-nav-link u-white\" href=\"#\">Menu Item1</a></li><li class=\"u-nav-item\"><a class=\"u-button-style u-nav-link u-white\" href=\"#\">Menu Item2</a></li><li class=\"u-nav-item\"><a class=\"u-button-style u-nav-link u-white\" href=\"#\">Menu Item3</a></li></ul></div></li><li class=\"u-nav-item\"><a class=\"u-button-style u-nav-link\" href=\"Acerca-de.html\" data-page-id=\"294843761\" style=\"padding: 8px 0px;\">Acerca de</a></li><li class=\"u-nav-item\"><a class=\"u-button-style u-nav-link\" href=\"Contacto.html\" data-page-id=\"2037893\" style=\"padding: 8px 0px;\">Contacto</a></li></ul>\n      </div>\n      <div class=\"u-nav-container-collapse\">\n        <div class=\"u-black u-container-style u-inner-container-layout u-opacity u-opacity-95 u-sidenav u-block-2cdd-6\"><div class=\"u-inner-container-layout u-sidenav-overflow\">\n          <div class=\"u-menu-close u-block-2cdd-7\"></div>\n          <ul class=\"u-align-center u-nav u-popupmenu-items u-unstyled u-block-2cdd-8\"><li class=\"u-nav-item\"><a class=\"u-button-style u-nav-link\" href=\"Casa.html\" data-page-id=\"122998333\">Casa</a><div class=\"fake u-nav-popup u-block-2cdd-12\"><ul class=\"u-h-spacing-20 u-nav u-unstyled u-v-spacing-10 u-block-2cdd-13\"><li class=\"u-nav-item\"><a class=\"u-button-style u-nav-link\" href=\"#\">Menu Item1</a></li><li class=\"u-nav-item\"><a class=\"u-button-style u-nav-link\" href=\"#\">Menu Item2</a></li><li class=\"u-nav-item\"><a class=\"u-button-style u-nav-link\" href=\"#\">Menu Item3</a></li></ul></div></li><li class=\"u-nav-item\"><a class=\"u-button-style u-nav-link\" href=\"Acerca-de.html\" data-page-id=\"294843761\">Acerca de</a></li><li class=\"u-nav-item\"><a class=\"u-button-style u-nav-link\" href=\"Contacto.html\" data-page-id=\"2037893\">Contacto</a></li></ul>\n        </div></div>\n        <div class=\"u-black u-menu-overlay u-opacity u-opacity-70\"></div>\n      </div>\n    </nav>\n  </div>\n  <style data-mode=\"XL\" data-visited=\"true\">@media (min-width: 1200px){ .u-block-2cdd-1 {background-image: none}\n.u-block-2cdd-2 {min-height: 74px}\n.u-block-2cdd-3 {margin-top: 19px; margin-right: 839px; margin-bottom: 0px; margin-left: 0px}\n.u-block-2cdd-4 {margin-top: -36.5px; margin-right: 0px; margin-bottom: 4.5px; margin-left: auto}\n.u-block-2cdd-8 {font-size: 1.25rem} }</style>\n  <style data-mode=\"LG\" data-visited=\"true\">@media (max-width: 1199px) and (min-width: 992px){ .u-block-2cdd-1 {background-image: none}\n.u-block-2cdd-2 {min-height: 74px}\n.u-block-2cdd-3 {margin-top: 19.5px; margin-right: 637.156px; margin-bottom: 0px; margin-left: 0px}\n.u-block-2cdd-4 {margin-top: -36px; margin-right: 0px; margin-bottom: 22.5px; margin-left: auto}\n.u-block-2cdd-8 {font-size: 1.25rem} }</style>\n  <style data-mode=\"MD\" data-visited=\"true\">@media (max-width: 991px) and (min-width: 768px){ .u-block-2cdd-1 {background-image: none}\n.u-block-2cdd-2 {min-height: 74px}\n.u-block-2cdd-3 {margin-top: 19.5px; margin-right: 418.156px; margin-bottom: 0px; margin-left: 0px}\n.u-block-2cdd-4 {margin-top: -34px; margin-right: 0px; margin-bottom: 20.5px; margin-left: auto}\n.u-block-2cdd-8 {font-size: 1.25rem} }</style>\n  <style data-mode=\"SM\" data-visited=\"true\">@media (max-width: 767px) and (min-width: 576px){ .u-block-2cdd-1 {background-image: none}\n.u-block-2cdd-2 {min-height: 74px}\n.u-block-2cdd-3 {margin-top: 19.5px; margin-right: 270px; margin-bottom: 0px; margin-left: 0px}\n.u-block-2cdd-4 {width: 24px; margin-top: -34px; margin-right: 0px; margin-bottom: 20.5px; margin-left: auto}\n.u-block-2cdd-8 {font-size: 1.25rem} }</style>\n  <style data-mode=\"XS\" data-visited=\"true\">@media (max-width: 575px){ .u-block-2cdd-1 {background-image: none}\n.u-block-2cdd-2 {min-height: 80px}\n.u-block-2cdd-3 {margin-top: 22px; margin-right: 91px; margin-bottom: 0px; margin-left: 0px}\n.u-block-2cdd-4 {margin-top: -34px; margin-right: 0px; margin-bottom: 24px; margin-left: auto; width: 24px}\n.u-block-2cdd-8 {font-size: 1.25rem} }</style>\n</section>","footerHtml":"<section class=\"u-black u-clearfix u-footer u-block-e393-1\" custom-posts-hash=\"[T,T,T]\" data-style=\"footer-3-cols\" data-post-id=\"3459605550;2128482347;2128482347\" data-section-properties=\"{&quot;grid-spacing&quot;:&quot;30&quot;,&quot;spacingAdditional&quot;:&quot;none&quot;,&quot;align&quot;:&quot;center&quot;,&quot;stretch&quot;:true}\" id=\"sec-abf8\" data-source=\"\" data-id=\"e393\">\n  <div class=\"u-clearfix u-sheet u-block-e393-2\" data-height-sm=\"444\" data-height-lg=\"192\" data-height-md=\"192\" data-height-xs=\"81\">\n    \n  </div>\n  <style data-mode=\"XL\" data-visited=\"true\">@media (min-width: 1200px){ .u-block-e393-2 {min-height: 192px} }</style>\n  <style data-mode=\"LG\" data-visited=\"true\">@media (max-width: 1199px) and (min-width: 992px){ .u-block-e393-2 {min-height: 192px} }</style>\n  <style data-mode=\"MD\" data-visited=\"true\">@media (max-width: 991px) and (min-width: 768px){ .u-block-e393-2 {min-height: 81px} }</style>\n  <style data-mode=\"SM\" data-visited=\"true\">@media (max-width: 767px) and (min-width: 576px){ .u-block-e393-2 {min-height: 81px} }</style>\n  <style data-mode=\"XS\" data-visited=\"true\">@media (max-width: 575px){ .u-block-e393-2 {min-height: 81px} }</style>\n</section>","hideBacklink":null,"dateUpdated":1716089388346,"settings":"{\"colorScheme\":{\"bodyColors\":[\"#111111\",\"#ffffff\"],\"bgColor\":\"#ffffff\",\"colors\":[\"#e3b377\",\"#e5492c\",\"#8bc9ba\",\"#f4e1cb\",\"#dddbd9\"],\"shadingContrast\":\"body-alt-color\",\"whiteContrast\":\"body-color\",\"bgContrast\":\"body-color\",\"name\":\"u11\"},\"fontScheme\":{\"name\":\"custom-font-family-3\",\"fonts\":{\"heading\":\"Playfair Display, serif\",\"text\":\"Open Sans, sans-serif\",\"accent\":\"Arial, sans-serif\",\"headingTitle\":\"Playfair Display\",\"textTitle\":\"Open Sans\"}},\"typography\":{\"name\":\"custom-page-typography-9\",\"title\":{\"font-weight\":\"700\",\"line-height\":\"1_1\",\"font-size\":3.75,\"margin-top\":20,\"margin-bottom\":20,\"text-color\":\"palette-5-dark-3\",\"font\":\"Playfair Display, serif\"},\"subtitle\":{\"font-weight\":\"700\",\"line-height\":\"1_2\",\"font-size\":2.25,\"margin-top\":20,\"margin-bottom\":20,\"text-color\":\"palette-5-dark-2\"},\"h1\":{\"line-height\":\"1_1\",\"font-size\":4.375,\"margin-top\":20,\"margin-bottom\":20,\"text-color\":\"palette-5-dark-3\",\"font-weight\":\"700\",\"font-style\":\"\",\"text-decoration\":\"\",\"text-transform\":\"\",\"letter-spacing\":\"\",\"border-color\":\"\",\"border-style\":\"\",\"color\":\"\",\"border\":\"\",\"button-shape\":\"\",\"border-radius\":\"\",\"underline\":\"\",\"gradient\":\"\",\"list-icon-src\":\"\",\"list-icon-spacing\":\"0.3\",\"list-icon-size\":\"0.8\",\"font\":\"\"},\"h2\":{\"font-weight\":\"700\",\"line-height\":\"1_2\",\"font-size\":3.75,\"margin-top\":20,\"margin-bottom\":20,\"text-color\":\"palette-5-dark-3\",\"SM\":{\"font-size\":3,\"font-weight\":\"700\",\"font-style\":\"\",\"text-decoration\":\"\",\"text-transform\":\"\",\"line-height\":\"1_2\",\"letter-spacing\":\"\",\"text-color\":\"palette-5-dark-3\",\"border-color\":\"\",\"border-style\":\"\",\"color\":\"\",\"border\":\"\",\"button-shape\":\"\",\"border-radius\":\"\",\"underline\":\"\",\"gradient\":\"\",\"list-icon-src\":\"\",\"list-icon-spacing\":\"0.3\",\"list-icon-size\":\"0.8\"},\"font\":\"\",\"XS\":{\"font-size\":2.25,\"font-weight\":\"700\",\"font-style\":\"\",\"text-decoration\":\"\",\"text-transform\":\"\",\"line-height\":\"1_2\",\"letter-spacing\":\"\",\"text-color\":\"palette-5-dark-3\",\"border-color\":\"\",\"border-style\":\"\",\"color\":\"\",\"border\":\"\",\"button-shape\":\"\",\"border-radius\":\"\",\"underline\":\"\",\"gradient\":\"\",\"list-icon-src\":\"\",\"list-icon-spacing\":\"0.3\",\"list-icon-size\":\"0.8\"}},\"h3\":{\"line-height\":\"1_2\",\"font-size\":1.875,\"margin-top\":20,\"margin-bottom\":20,\"text-color\":\"palette-2-base\",\"text-transform\":\"uppercase\",\"font\":\"Agbalumo\",\"letter-spacing\":\"2\",\"font-weight\":\"700\"},\"h4\":{\"font-weight\":\"700\",\"line-height\":\"1_2\",\"font-size\":1.5,\"margin-top\":20,\"margin-bottom\":20,\"text-color\":\"palette-5-dark-3\"},\"h5\":{\"line-height\":1.8,\"font-size\":1.5,\"margin-top\":20,\"margin-bottom\":20,\"text-color\":\"palette-5-dark-3\",\"font-weight\":700,\"font-style\":\"\",\"text-decoration\":\"\",\"text-transform\":\"\",\"letter-spacing\":\"\",\"border-color\":\"\",\"border-style\":\"\",\"color\":\"\",\"border\":\"\",\"button-shape\":\"\",\"border-radius\":\"\",\"underline\":\"\",\"gradient\":\"\",\"list-icon-src\":\"\",\"list-icon-spacing\":\"0.3\",\"list-icon-size\":\"0.8\",\"font\":\"Montserrat, sans-serif\"},\"h6\":{\"font-weight\":\"700\",\"line-height\":\"1_2\",\"font-size\":1.125,\"margin-top\":20,\"margin-bottom\":20,\"text-color\":\"palette-5-dark-3\"},\"largeText\":{\"bold\":false,\"line-height\":\"1_6\",\"font-size\":1,\"margin-top\":20,\"margin-bottom\":20,\"text-color\":\"palette-5-dark-3\"},\"text\":{\"line-height\":\"2.2\",\"font-size\":1.25,\"margin-top\":20,\"margin-bottom\":20,\"font\":\"Agbalumo\",\"font-weight\":\"\",\"font-style\":\"\",\"text-decoration\":\"\",\"text-transform\":\"\",\"letter-spacing\":\"\",\"text-color\":\"\",\"border-color\":\"\",\"border-style\":\"\",\"color\":\"\",\"border\":\"\",\"button-shape\":\"\",\"border-radius\":\"\",\"underline\":\"\",\"gradient\":\"\",\"list-icon-src\":\"\",\"list-icon-spacing\":\"0.3\",\"list-icon-size\":\"0.8\",\"XS\":{\"font-size\":1.125,\"font-weight\":\"\",\"font-style\":\"\",\"text-decoration\":\"\",\"text-transform\":\"\",\"line-height\":\"2.2\",\"letter-spacing\":\"\",\"text-color\":\"\",\"border-color\":\"\",\"border-style\":\"\",\"color\":\"\",\"border\":\"\",\"button-shape\":\"\",\"border-radius\":\"\",\"underline\":\"\",\"gradient\":\"\",\"list-icon-src\":\"\",\"list-icon-spacing\":\"0.3\",\"list-icon-size\":\"0.8\"}},\"smallText\":{\"bold\":false,\"line-height\":\"1_6\",\"font-size\":0.875,\"margin-top\":20,\"margin-bottom\":20},\"link\":{},\"button\":{\"letter-spacing\":\"1\",\"font-size\":1,\"line-height\":\"1_4\",\"color\":\"palette-1-dark-3\",\"margin-top\":20,\"margin-bottom\":20,\"text-transform\":\"uppercase\",\"border-color\":false,\"border-top-style\":\"none\",\"border-left-style\":\"none\",\"border-right-style\":\"none\",\"border-bottom-style\":\"none\",\"borders\":\"top right bottom left\",\"border-radius\":6,\"button-shape\":\"round\",\"image-size\":{\"width\":0,\"height\":0},\"image-fit\":\"cover\",\"image-zoom\":100,\"animation\":{\"animationName\":null,\"animationDuration\":null,\"animationDelay\":null,\"animationDirection\":null}},\"blockquote\":{\"font-style\":\"italic\",\"line-height\":\"1_6\",\"font-size\":1.25,\"indent\":20,\"border\":4,\"border-color\":\"palette-1-base\",\"margin-top\":20,\"margin-bottom\":20,\"border-style\":\"solid\"},\"metadata\":{\"font-size\":0.75,\"line-height\":\"1_4\",\"margin-top\":20,\"margin-bottom\":20},\"list\":{\"margin-top\":20,\"margin-bottom\":20},\"orderedlist\":{\"margin-top\":20,\"margin-bottom\":20},\"postContent\":{\"margin-top\":20,\"margin-bottom\":20},\"theme\":{\"gradient\":\"\",\"image\":\"\",\"sheet-width-xl\":1140,\"sheet-width-lg\":940,\"sheet-width-md\":720,\"sheet-width-sm\":540,\"sheet-width-xs\":340},\"htmlBaseSize\":16,\"hyperlink\":{\"text-color\":\"palette-1-base\"},\"form-input\":{\"border\":1,\"border-color\":\"grey-30\",\"borders\":\"top right bottom left\",\"color\":\"white\",\"text-color\":\"black\"}},\"backToTop\":\"<span style=\\\"height: 64px; width: 64px; margin-left: 0px; margin-right: auto; margin-top: 0px; background-image: none; right: 20px; bottom: 20px; padding: 15px\\\" class=\\\"u-back-to-top u-icon u-icon-circle u-opacity u-opacity-85 u-palette-1-base u-spacing-15\\\" data-href=\\\"#\\\">\\n        <svg class=\\\"u-svg-link\\\" preserveAspectRatio=\\\"xMidYMin slice\\\" viewBox=\\\"0 0 551.13 551.13\\\">\\n            <use xmlns:xlink=\\\"http://www.w3.org/1999/xlink\\\" xlink:href=\\\"#svg-1d98\\\"></use>\\n        </svg>\\n        <svg class=\\\"u-svg-content\\\" enable-background=\\\"new 0 0 551.13 551.13\\\" viewBox=\\\"0 0 551.13 551.13\\\" xmlns=\\\"http://www.w3.org/2000/svg\\\" id=\\\"svg-1d98\\\">\\n            <path d=\\\"m275.565 189.451 223.897 223.897h51.668l-275.565-275.565-275.565 275.565h51.668z\\\"></path>\\n        </svg>\\n    </span>\",\"themeBackLinks\":\"{\\\"data-wp-back-link\\\":\\\"https://nicepage.com/wordpress-themes\\\",\\\"data-wp-back-link-title\\\":\\\"WordPress Themes\\\",\\\"data-jm-back-link\\\":\\\"https://nicepage.com/joomla-templates\\\",\\\"data-jm-back-link-title\\\":\\\"Joomla Template\\\"}\",\"lang\":\"es\",\"dialog\":[{\"id\":\"1\",\"name\":\"Ventana emergente de Pago\",\"type\":\"payment\",\"sectionAnchorId\":\"sec-e5a4\",\"html\":\"<section class=\\\"u-black u-clearfix u-container-style u-dialog-block u-dialog-open u-opacity u-opacity-70 u-payment-dialog u-valign-middle u-block-5bfb-1\\\" style=\\\"\\\" data-id=\\\"5bfb\\\" data-posts-content=\\\"[{'images':[],'maps':[],'videos':[],'icons':[{}],'textWidth':'','textHeight':'','id':1,'groupId':1,'headingProp':'h5','textProp':'text'},{'images':[],'maps':[],'videos':[],'icons':[],'textWidth':'','textHeight':'','id':2,'groupId':1,'headingProp':'h5','textProp':'text'}]\\\" custom-posts-hash=\\\"[T,T,T]\\\" data-section-content=\\\"{'images':[],'headings':[{'repeater':true,'length':44,'cellsCount':1},{'repeater':false,'length':30,'cellsCount':1}],'texts':[{'repeater':true,'length':120,'cellsCount':1}],'tables':[],'customLists':[],'accordions':[],'textGroupCount':3,'textLength':168}\\\" data-style=\\\"payment-dialog\\\" id=\\\"sec-e5a4\\\" data-source=\\\"Sketch\\\">\\n  <div style=\\\"width: 570px; min-height: 578px; height: auto; box-shadow: 0px 0px 8px 0px rgba(var(--black-r),var(--black-g),var(--black-b),0.2); margin-top: 60px; margin-bottom: 60px; margin-left: auto; margin-right: auto\\\" class=\\\"u-align-center u-container-style u-dialog u-radius-25 u-shape-round u-white u-block-5bfb-2\\\">\\n    <div class=\\\"u-container-layout u-valign-top u-block-5bfb-3\\\" style=\\\"padding-top: 34px; padding-bottom: 34px; padding-left: 35px; padding-right: 35px\\\">\\n      <h5 class=\\\"u-align-left u-text u-block-5bfb-26\\\" style=\\\"font-weight: 700; margin-top: 0px; margin-right: 165.016px; margin-bottom: 0px; margin-left: 0px\\\">Buy Now</h5>\\n      <div class=\\\"u-expanded-width u-products u-block-5bfb-5\\\" style=\\\"margin-top: 30px; margin-bottom: 0px\\\" data-site-sorting-prop=\\\"created\\\" data-site-sorting-order=\\\"desc\\\">\\n        <div class=\\\"u-list-control\\\"></div>\\n        <div class=\\\"u-repeater u-block-5bfb-6\\\" style=\\\"grid-template-columns: 100%; min-height: 206px; grid-gap: 10px\\\">\\n          <div class=\\\"u-container-style u-products-item u-repeater-item u-block-5bfb-7\\\" style=\\\"\\\">\\n            <div class=\\\"u-container-layout u-similar-container u-block-5bfb-8\\\" style=\\\"padding-top: 0px; padding-left: 0px; padding-right: 0px; padding-bottom: 30px\\\">\\n              <h5 class=\\\"u-align-left u-product-control u-text u-block-5bfb-27\\\" style=\\\"background-image: none; margin-top: 0px; margin-bottom: 0px; margin-left: 0px; margin-right: 0px\\\">\\n                <a class=\\\"u-product-title-link\\\" href=\\\"#\\\">Product 1 Title</a>\\n              </h5>\\n              <div class=\\\"u-align-left u-product-control u-product-desc u-text u-block-5bfb-29\\\" style=\\\"font-size: 0.875rem; margin-top: 20px; margin-left: 0px; margin-right: 0px; margin-bottom: 0px\\\">\\n                <p>Sample text. Lorem ipsum dolor sit amet, consectetur adipiscing elit nullam nunc justo sagittis suscipit ultrices.</p>\\n              </div>\\n              <div class=\\\"u-align-left u-product-control u-product-quantity u-block-5bfb-35\\\" style=\\\"width: 125px; margin-top: 30px; margin-right: auto; margin-bottom: 0px; margin-left: 0px\\\">\\n                <div class=\\\"u-hidden u-quantity-label\\\">Quantity</div>\\n                <div class=\\\"u-border-1 u-border-grey-30 u-quantity-input u-radius-50\\\">\\n                  <a class=\\\"disabled minus u-button-style u-quantity-button u-text-body-color\\\">\\n                    <svg xmlns=\\\"http://www.w3.org/2000/svg\\\" viewBox=\\\"0 0 16 16\\\"><path d=\\\"m 4 8 h 8\\\" fill=\\\"none\\\" stroke=\\\"currentColor\\\" stroke-width=\\\"1\\\" fill-rule=\\\"evenodd\\\"></path></svg>\\n                  </a>\\n                  <input class=\\\"u-input u-block-5bfb-36\\\" type=\\\"text\\\" value=\\\"1\\\" pattern=\\\"[0-9]+\\\" style=\\\"\\\">\\n                  <a class=\\\"plus u-button-style u-quantity-button u-text-body-color\\\">\\n                    <svg xmlns=\\\"http://www.w3.org/2000/svg\\\" viewBox=\\\"0 0 16 16\\\"><path d=\\\"m 4 8 h 8 M 8 4 v 8\\\" fill=\\\"none\\\" stroke=\\\"currentColor\\\" stroke-width=\\\"1\\\" fill-rule=\\\"evenodd\\\"></path></svg>\\n                  </a>\\n                </div>\\n              </div>\\n              <div data-add-zero-cents=\\\"true\\\" class=\\\"u-align-left u-product-control u-product-price u-block-5bfb-12\\\" style=\\\"margin-top: -34px; margin-right: 0px; margin-bottom: 0px; margin-left: auto\\\">\\n                <div class=\\\"u-price-wrapper u-spacing-10\\\">\\n                  <div class=\\\"u-old-price\\\" style=\\\"text-decoration: line-through !important;\\\">$20.00</div>\\n                  <div class=\\\"u-price\\\" style=\\\"font-size: 1.25rem; font-weight: 700;\\\">$17.00</div>\\n                </div>\\n              </div>\\n            </div>\\n          </div>\\n        </div>\\n        <div class=\\\"u-list-control\\\"></div>\\n      </div>\\n      <div class=\\\"u-expanded-width u-payment-services u-tab-links-align-justify u-tab-payment u-tab-vertical u-tabs u-block-5bfb-38\\\" data-payment-order-approved-message=\\\"Your order has been approved. Thank you!\\\" data-payment-order-cancelled-message=\\\"Unable to process your order. Please try again later.\\\" style=\\\"min-height: 250px; min-width: 50px; margin-top: 0px; margin-bottom: 0px; margin-left: 0px; margin-right: 0px\\\">\\n        <ul class=\\\"u-tab-list u-unstyled u-block-5bfb-39\\\" role=\\\"tablist\\\" style=\\\"\\\"><li class=\\\"u-tab-item u-block-5bfb-40\\\" role=\\\"presentation\\\" style=\\\"\\\"><a class=\\\"active u-active-grey-10 u-button-style u-payment-paypal u-tab-link u-text-body-color u-block-5bfb-41\\\" id=\\\"link-tab-9cb3\\\" href=\\\"#tab-9cb3\\\" role=\\\"tab\\\" aria-controls=\\\"tab-9cb3\\\" aria-selected=\\\"true\\\" style=\\\"\\\"><input type=\\\"radio\\\" class=\\\"u-field-input u-grey-15 u-radius-15\\\" name=\\\"payment-group\\\" checked=\\\"checked\\\"><span>Paypal</span><svg class=\\\"u-svg-content\\\" xmlns=\\\"http://www.w3.org/2000/svg\\\" x=\\\"0px\\\" y=\\\"0px\\\"><path fill=\\\"#009EE3\\\" d=\\\"M11,5.9H18c3.8,0,5.2,1.9,4.9,4.7c-0.3,4.7-3.2,7.2-6.9,7.2h-1.9c-0.5,0-0.8,0.3-0.9,1.3l-0.8,4.3\\n  c-0.1,0.3-0.2,0.5-0.5,0.6H7.6c-0.4,0-0.5-0.3-0.4-1l2.6-16C9.9,6.3,10.2,5.9,11,5.9z\\\"></path><path fill=\\\"#113984\\\" d=\\\"M6.7,0h7.1c2,0,4.3,0.1,5.9,1.5c1.1,0.9,1.6,2.4,1.5,4c-0.4,5.4-3.7,8.5-8,8.5H9.6c-0.6,0-0.9,0.4-1.2,1.5\\n  l-0.9,5.1C7.4,21,7.3,21.3,7,21.3H2.6C2,21.3,1.9,21,2,20.1L5.2,1.3C5.3,0.4,5.7,0,6.7,0z\\\"></path><path fill=\\\"#172C70\\\" d=\\\"M8.6,14.8l1.3-7.9c0.1-0.7,0.5-1,1.3-1h7.1c1.2,0,2.1,0.2,2.8,0.5c-0.7,4.8-3.8,7.5-7.9,7.5H9.6\\n  C9.1,13.9,8.8,14.1,8.6,14.8z\\\"></path></svg>\\n</a>\\n</li><li class=\\\"u-tab-item u-block-5bfb-42\\\" role=\\\"presentation\\\" style=\\\"\\\"><a class=\\\"u-active-grey-10 u-button-style u-payment-stripe u-tab-link u-text-body-color u-block-5bfb-43\\\" id=\\\"link-tab-ab80\\\" href=\\\"#tab-ab80\\\" role=\\\"tab\\\" aria-controls=\\\"tab-ab80\\\" aria-selected=\\\"false\\\" style=\\\"\\\"><input type=\\\"radio\\\" class=\\\"u-field-input u-grey-15 u-radius-15\\\" name=\\\"payment-group\\\"><span>Stripe</span><svg class=\\\"u-svg-content\\\" xmlns=\\\"http://www.w3.org/2000/svg\\\" x=\\\"0px\\\" y=\\\"0px\\\" viewBox=\\\"0 0 24 24\\\"><path fill=\\\"#635BFF\\\" d=\\\"M14,9.2c-2.3-0.8-3.4-1.5-3.4-2.4c0-0.8,0.8-1.3,2-1.3c2.3,0,4.7,0.8,6.4,1.6l0.9-5.5\\n  c-1.3-0.5-4-1.6-7.7-1.6C9.6,0,7.5,0.7,5.8,1.9C4.1,3.2,3.4,4.9,3.4,7.2c0,4,2.6,5.7,6.8,7.2c2.7,0.9,3.6,1.6,3.6,2.5\\n  c0,0.9-0.9,1.6-2.4,1.6c-1.9,0-5.2-0.9-7.3-2.1L3,22c1.8,0.9,5.1,2,8.7,2c2.8,0,5.1-0.7,6.6-1.9c1.8-1.3,2.7-3.2,2.7-5.7\\n  C20.9,12.3,18.2,10.7,14,9.2L14,9.2z\\\"></path></svg>\\n</a>\\n</li></ul>\\n        <div class=\\\"u-tab-content u-block-5bfb-44\\\" style=\\\"\\\">\\n          <div class=\\\"u-container-style u-payment-paypal u-tab-active u-tab-pane u-block-5bfb-45\\\" id=\\\"tab-9cb3\\\" role=\\\"tabpanel\\\" aria-labelledby=\\\"link-tab-9cb3\\\" style=\\\"\\\">\\n            <div class=\\\"u-container-layout u-payment-services-inner u-block-5bfb-46\\\" style=\\\"padding-top: 20px; padding-right: 0; padding-bottom: 0; padding-left: 0\\\" data-payment-loading-message=\\\"Loading...\\\">Here you will see the payment buttons on the live website.</div>\\n          </div>\\n          <div class=\\\"u-container-style u-payment-stripe u-tab-pane u-block-5bfb-47\\\" id=\\\"tab-ab80\\\" role=\\\"tabpanel\\\" aria-labelledby=\\\"link-tab-ab80\\\" style=\\\"\\\">\\n            <div class=\\\"u-container-layout u-block-5bfb-48\\\" style=\\\"padding-top: 20px; padding-right: 0; padding-bottom: 0; padding-left: 0\\\">\\n              <a href=\\\"#\\\" class=\\\"u-btn u-button-style u-stripe-button u-block-5bfb-49\\\" style=\\\"width: 100%; margin-top: 0; margin-bottom: 0; margin-left: auto; margin-right: auto\\\">Pay with Stripe</a>\\n            </div>\\n          </div>\\n        </div>\\n      </div>\\n    </div><button class=\\\"u-dialog-close-button u-icon u-text-grey-40 u-block-5bfb-4\\\" style=\\\"width: 20.0939px; height: 20.0939px; left: auto; top: 35.9532px; position: absolute; right: 35px; padding-top: 0px; padding-bottom: 0px; padding-left: 0px; padding-right: 0px\\\"><svg class=\\\"u-svg-link\\\" preserveAspectRatio=\\\"xMidYMin slice\\\" viewBox=\\\"0 0 16 16\\\" style=\\\"\\\"><use xmlns:xlink=\\\"http://www.w3.org/1999/xlink\\\" xlink:href=\\\"#svg-efe9\\\"></use></svg><svg xmlns=\\\"http://www.w3.org/2000/svg\\\" xmlns:xlink=\\\"http://www.w3.org/1999/xlink\\\" version=\\\"1.1\\\" xml:space=\\\"preserve\\\" class=\\\"u-svg-content\\\" viewBox=\\\"0 0 16 16\\\" x=\\\"0px\\\" y=\\\"0px\\\" id=\\\"svg-efe9\\\"><rect x=\\\"7\\\" y=\\\"0\\\" transform=\\\"matrix(0.7071 -0.7071 0.7071 0.7071 -3.3138 8.0002)\\\" width=\\\"2\\\" height=\\\"16\\\"></rect><rect x=\\\"0\\\" y=\\\"7\\\" transform=\\\"matrix(0.7071 -0.7071 0.7071 0.7071 -3.3138 8.0002)\\\" width=\\\"16\\\" height=\\\"2\\\"></rect></svg></button>\\n  </div>\\n  <style data-mode=\\\"XL\\\" data-visited=\\\"true\\\">@media (max-width: 0px) { .u-block-5bfb-2 {width: 570px; min-height: 578px; height: auto; box-shadow: 0px 0px 8px 0px rgba(var(--black-r),var(--black-g),var(--black-b),0.2); margin-top: 60px; margin-bottom: 60px; margin-left: auto; margin-right: auto}\\n.u-block-5bfb-3 {padding-top: 34px; padding-bottom: 34px; padding-left: 35px; padding-right: 35px}\\n.u-block-5bfb-26 {font-weight: 700; margin-top: 0px; margin-right: 165.016px; margin-bottom: 0px; margin-left: 0px}\\n.u-block-5bfb-5 {margin-top: 30px; margin-bottom: 0px}\\n.u-block-5bfb-6 {grid-template-columns: 100%; min-height: 206px; grid-gap: 10px}\\n.u-block-5bfb-8 {padding-top: 0px; padding-left: 0px; padding-right: 0px; padding-bottom: 30px}\\n.u-block-5bfb-27 {background-image: none; margin-top: 0px; margin-bottom: 0px; margin-left: 0px; margin-right: 0px}\\n.u-block-5bfb-29 {font-size: 0.875rem; margin-top: 20px; margin-left: 0px; margin-right: 0px; margin-bottom: 0px}\\n.u-block-5bfb-35 {width: 125px; margin-top: 30px; margin-right: auto; margin-bottom: 0px; margin-left: 0px}\\n.u-block-5bfb-12 {margin-top: -34px; margin-right: 0px; margin-bottom: 0px; margin-left: auto}\\n.u-block-5bfb-38 {min-height: 250px; min-width: 50px; margin-top: 0px; margin-bottom: 0px; margin-left: 0px; margin-right: 0px}\\n.u-block-5bfb-46 {padding-top: 20px; padding-right: 0; padding-bottom: 0; padding-left: 0}\\n.u-block-5bfb-48 {padding-top: 20px; padding-right: 0; padding-bottom: 0; padding-left: 0}\\n.u-block-5bfb-49 {width: 100%; margin-top: 0; margin-bottom: 0; margin-left: auto; margin-right: auto}\\n.u-block-5bfb-4 {width: 20.0939px; height: 20.0939px; left: auto; top: 35.9532px; position: absolute; right: 35px; padding-top: 0px; padding-bottom: 0px; padding-left: 0px; padding-right: 0px} }</style>\\n  <style data-mode=\\\"LG\\\" data-visited=\\\"true\\\">@media (max-width: 0px) { .u-block-5bfb-2 {box-shadow: 0px 0px 8px 0px rgba(var(--black-r),var(--black-g),var(--black-b),0.2); width: 570px; height: auto; margin-top: 60px; margin-left: auto; margin-right: auto; margin-bottom: 60px; min-height: 578px}\\n.u-block-5bfb-3 {padding-top: 34px; padding-bottom: 34px; padding-left: 35px; padding-right: 35px}\\n.u-block-5bfb-26 {font-weight: 700; margin-top: 0px; margin-right: 165px; margin-bottom: 0px; margin-left: 0px}\\n.u-block-5bfb-5 {margin-top: 30px; margin-bottom: 0px}\\n.u-block-5bfb-6 {grid-template-columns: 100%; min-height: 206px; grid-gap: 10px}\\n.u-block-5bfb-8 {padding-top: 0px; padding-left: 0px; padding-right: 0px; padding-bottom: 30px}\\n.u-block-5bfb-27 {background-image: none; margin-top: 0px; margin-bottom: 0px; margin-left: 0px; margin-right: 0px}\\n.u-block-5bfb-29 {font-size: 0.875rem; margin-top: 20px; margin-left: 0px; margin-right: 0px; margin-bottom: 0px}\\n.u-block-5bfb-35 {width: 125px; margin-top: 30px; margin-right: auto; margin-bottom: 0px; margin-left: 0px}\\n.u-block-5bfb-12 {margin-top: -34px; margin-right: 0px; margin-bottom: 0px; margin-left: auto}\\n.u-block-5bfb-38 {min-height: 250px; min-width: 50px; margin-top: 0px; margin-bottom: 0px}\\n.u-block-5bfb-46 {padding-top: 20px; padding-bottom: 0; padding-left: 0; padding-right: 0}\\n.u-block-5bfb-48 {padding-top: 20px; padding-bottom: 0; padding-left: 0; padding-right: 0}\\n.u-block-5bfb-49 {width: 100%; margin-top: 0; margin-bottom: 0; margin-left: auto; margin-right: auto}\\n.u-block-5bfb-4 {width: 20.0939px; height: 20.0939px; left: auto; top: 35.9532px; position: absolute; right: 35px; padding-top: 0px; padding-bottom: 0px; padding-left: 0px; padding-right: 0px} }</style>\\n  <style data-mode=\\\"MD\\\" data-visited=\\\"true\\\">@media (max-width: 0px) { .u-block-5bfb-2 {box-shadow: 0px 0px 8px 0px rgba(var(--black-r),var(--black-g),var(--black-b),0.2); width: 570px; height: auto; margin-top: 60px; margin-left: auto; margin-right: auto; margin-bottom: 60px; min-height: 578px}\\n.u-block-5bfb-3 {padding-top: 30px; padding-bottom: 30px; padding-left: 30px; padding-right: 30px}\\n.u-block-5bfb-26 {font-weight: 700; margin-top: 0px; margin-right: 165px; margin-bottom: 0px; margin-left: 0px}\\n.u-block-5bfb-5 {margin-top: 30px; margin-bottom: 0px}\\n.u-block-5bfb-6 {grid-template-columns: 100%; min-height: 206px; grid-gap: 10px}\\n.u-block-5bfb-8 {padding-top: 0px; padding-left: 0px; padding-right: 0px; padding-bottom: 30px}\\n.u-block-5bfb-27 {background-image: none; margin-top: 0px; margin-bottom: 0px; margin-left: 0px; margin-right: 0px}\\n.u-block-5bfb-29 {font-size: 0.875rem; margin-top: 20px; margin-left: 0px; margin-right: 0px; margin-bottom: 0px}\\n.u-block-5bfb-35 {width: 125px; margin-top: 30px; margin-right: auto; margin-bottom: 0px; margin-left: 0px}\\n.u-block-5bfb-12 {margin-top: -34px; margin-right: 0px; margin-bottom: 0px; margin-left: auto}\\n.u-block-5bfb-38 {min-height: 250px; min-width: 50px; margin-top: 0px; margin-bottom: 0px}\\n.u-block-5bfb-46 {padding-top: 20px; padding-bottom: 0px; padding-left: 0px; padding-right: 0px}\\n.u-block-5bfb-48 {padding-top: 20px; padding-bottom: 0px; padding-left: 0px; padding-right: 0px}\\n.u-block-5bfb-49 {width: 100%; margin-top: 0; margin-bottom: 0; margin-left: auto; margin-right: auto}\\n.u-block-5bfb-4 {width: 20.0939px; height: 20.0939px; left: auto; top: 31.9532px; position: absolute; right: 30px; padding-top: 0px; padding-bottom: 0px; padding-left: 0px; padding-right: 0px} }</style>\\n  <style data-mode=\\\"SM\\\" data-visited=\\\"true\\\">@media (max-width: 0px) { .u-block-5bfb-2 {box-shadow: 0px 0px 8px 0px rgba(var(--black-r),var(--black-g),var(--black-b),0.2); width: 540px; height: auto; margin-top: 60px; margin-left: auto; margin-right: auto; margin-bottom: 60px; min-height: 578px}\\n.u-block-5bfb-3 {padding-top: 30px; padding-bottom: 30px; padding-left: 30px; padding-right: 30px}\\n.u-block-5bfb-26 {font-weight: 700; margin-top: 0px; margin-right: 165px; margin-bottom: 0px; margin-left: 0px}\\n.u-block-5bfb-5 {margin-top: 30px; margin-bottom: 0px}\\n.u-block-5bfb-6 {grid-template-columns: 100%; min-height: 206px; grid-gap: 10px}\\n.u-block-5bfb-8 {padding-top: 0px; padding-left: 0px; padding-right: 0px; padding-bottom: 30px}\\n.u-block-5bfb-27 {background-image: none; margin-top: 0px; margin-bottom: 0px; margin-left: 0px; margin-right: 0px}\\n.u-block-5bfb-29 {font-size: 0.875rem; margin-top: 20px; margin-left: 0px; margin-right: 0px; margin-bottom: 0px}\\n.u-block-5bfb-35 {width: 125px; margin-top: 30px; margin-right: auto; margin-bottom: 0px; margin-left: 0px}\\n.u-block-5bfb-12 {margin-top: -34px; margin-right: 0px; margin-bottom: 0px; margin-left: auto}\\n.u-block-5bfb-38 {min-height: 250px; min-width: 50px; margin-top: 0px; margin-bottom: 0px}\\n.u-block-5bfb-46 {padding-top: 20px; padding-bottom: 0px; padding-left: 0px; padding-right: 0px}\\n.u-block-5bfb-48 {padding-top: 20px; padding-bottom: 0px; padding-left: 0px; padding-right: 0px}\\n.u-block-5bfb-49 {width: 100%; margin-top: 0; margin-bottom: 0; margin-left: auto; margin-right: auto}\\n.u-block-5bfb-4 {width: 20.0939px; height: 20.0939px; left: auto; top: 31.9532px; position: absolute; right: 30px; padding-top: 0px; padding-bottom: 0px; padding-left: 0px; padding-right: 0px} }</style>\\n  <style data-mode=\\\"XS\\\" data-visited=\\\"true\\\">@media (max-width: 0px) { .u-block-5bfb-2 {box-shadow: 0px 0px 8px 0px rgba(var(--black-r),var(--black-g),var(--black-b),0.2); width: 340px; height: auto; margin-top: 60px; margin-left: auto; margin-right: auto; margin-bottom: 60px; min-height: 578px}\\n.u-block-5bfb-3 {padding-top: 30px; padding-bottom: 30px; padding-left: 20px; padding-right: 20px}\\n.u-block-5bfb-26 {font-weight: 700; margin-top: 0px; margin-right: 5px; margin-bottom: 0px; margin-left: 0px}\\n.u-block-5bfb-5 {margin-top: 30px; margin-bottom: 0px}\\n.u-block-5bfb-6 {grid-template-columns: 100%; min-height: 206px; grid-gap: 10px}\\n.u-block-5bfb-8 {padding-top: 0px; padding-left: 0px; padding-right: 0px; padding-bottom: 30px}\\n.u-block-5bfb-27 {background-image: none; margin-top: 0px; margin-bottom: 0px; margin-left: 0px; margin-right: 0px}\\n.u-block-5bfb-29 {font-size: 0.875rem; margin-top: 20px; margin-left: 0px; margin-right: 0px; margin-bottom: 0px}\\n.u-block-5bfb-35 {width: 125px; margin-top: 30px; margin-right: auto; margin-bottom: 0px; margin-left: 0px}\\n.u-block-5bfb-12 {margin-top: -34px; margin-right: 0px; margin-bottom: 0px; margin-left: auto}\\n.u-block-5bfb-38 {min-height: 250px; min-width: 50px; margin-top: 0px; margin-bottom: 0px}\\n.u-block-5bfb-46 {padding-top: 20px; padding-bottom: 0px; padding-left: 0px; padding-right: 0px}\\n.u-block-5bfb-48 {padding-top: 20px; padding-bottom: 0px; padding-left: 0px; padding-right: 0px}\\n.u-block-5bfb-49 {width: 100%; margin-top: 0; margin-bottom: 0; margin-left: auto; margin-right: auto}\\n.u-block-5bfb-4 {width: 20.0939px; height: 20.0939px; left: auto; top: 31.9532px; position: absolute; right: 20px; padding-top: 0px; padding-bottom: 0px; padding-left: 0px; padding-right: 0px} }</style>\\n</section>\",\"showOn\":\"click\",\"showOnList\":[]}],\"id\":1550202704,\"langs\":[{\"id\":\"1\",\"name\":\"es\",\"title\":\"Spanish\"}],\"homePageId\":\"122998333\",\"formServices\":{\"25f9a827bc0e019d91ebd3d8f02e3438\":{\"id\":\"25f9a827bc0e019d91ebd3d8f02e3438\",\"type\":\"email\",\"token\":\"e7a1b9f2-dcb2-1e55-52a6-bbadf6551605\",\"email\":\"mapazanjr.3212@gmail.com\",\"isVerified\":true}},\"payment\":{\"services\":{}},\"captchaSiteKey\":\"6Lc2HDEiAAAAALpe1yqNarK-BmlyYl_MNPZx7_AB\",\"captchaSecretKey\":\"\",\"cookiesSection\":\"<section class=\\\"u-align-center u-block-9231-1 u-clearfix u-cookies-consent u-grey-80\\\" custom-posts-hash=\\\"T\\\" style=\\\"background-image: none\\\" data-post-id=\\\"1\\\" data-section-properties=\\\"{&quot;stretch&quot;:true}\\\" data-id=\\\"9231\\\" data-posts-content=\\\"[{'images':[],'maps':[],'videos':[],'icons':[],'textWidth':1064,'textHeight':152,'id':1,'headingProp':'h3','textProp':'text'}]\\\" data-section-content=\\\"{'images':[],'headings':[],'texts':[],'textGroupCount':1}\\\" data-style=\\\"cookie-1\\\" id=\\\"sec-a98e\\\" data-source=\\\"\\\">\\n  <div class=\\\"u-block-9231-2 u-clearfix u-sheet u-valign-middle\\\" style=\\\"min-height: 212px\\\" data-state=\\\"{&quot;margin-top&quot;:{&quot;shouldApplyDefaultMargins&quot;:{&quot;XL&quot;:false,&quot;LG&quot;:false,&quot;MD&quot;:false,&quot;SM&quot;:false,&quot;XS&quot;:false},&quot;parentVerticalAlign&quot;:{&quot;XL&quot;:&quot;middle&quot;,&quot;LG&quot;:&quot;middle&quot;,&quot;MD&quot;:&quot;middle&quot;,&quot;SM&quot;:&quot;middle&quot;,&quot;XS&quot;:&quot;middle&quot;}},&quot;margin-bottom&quot;:{&quot;shouldApplyDefaultMargins&quot;:{&quot;XL&quot;:false,&quot;LG&quot;:false,&quot;MD&quot;:false,&quot;SM&quot;:false,&quot;XS&quot;:false},&quot;parentVerticalAlign&quot;:{&quot;XL&quot;:&quot;middle&quot;,&quot;LG&quot;:&quot;middle&quot;,&quot;MD&quot;:&quot;middle&quot;,&quot;SM&quot;:&quot;middle&quot;,&quot;XS&quot;:&quot;middle&quot;}}}\\\" data-height-lg=\\\"158\\\" data-height-md=\\\"131\\\" data-height-sm=\\\"106\\\" data-height-xs=\\\"225\\\">\\n    <div class=\\\"u-block-9231-7 u-clearfix u-expanded-width u-layout-wrap\\\" style=\\\"margin-top: 30px; margin-bottom: 30px\\\" data-state=\\\"{&quot;margin-top&quot;:{&quot;shouldApplyDefaultMargins&quot;:{&quot;XL&quot;:false,&quot;LG&quot;:false,&quot;MD&quot;:false,&quot;SM&quot;:true,&quot;XS&quot;:true},&quot;parentVerticalAlign&quot;:{&quot;XL&quot;:&quot;middle&quot;,&quot;LG&quot;:&quot;middle&quot;,&quot;MD&quot;:&quot;middle&quot;,&quot;SM&quot;:&quot;middle&quot;,&quot;XS&quot;:&quot;middle&quot;}},&quot;margin-bottom&quot;:{&quot;shouldApplyDefaultMargins&quot;:{&quot;XL&quot;:false,&quot;LG&quot;:false,&quot;MD&quot;:false,&quot;SM&quot;:true,&quot;XS&quot;:true},&quot;parentVerticalAlign&quot;:{&quot;XL&quot;:&quot;middle&quot;,&quot;LG&quot;:&quot;middle&quot;,&quot;MD&quot;:&quot;middle&quot;,&quot;SM&quot;:&quot;middle&quot;,&quot;XS&quot;:&quot;middle&quot;}}}\\\">\\n      <div class=\\\"u-gutter-0 u-layout\\\">\\n        <div class=\\\"u-layout-row\\\">\\n          <div class=\\\"u-block-9231-8 u-container-style u-layout-cell u-left-cell u-size-43-md u-size-43-sm u-size-43-xs u-size-46-lg u-size-46-xl\\\" style=\\\"min-height: 152px\\\" data-state=\\\"{&quot;min-height&quot;:{&quot;expandedParent&quot;:{&quot;XL&quot;:true,&quot;LG&quot;:true,&quot;MD&quot;:true,&quot;SM&quot;:true,&quot;XS&quot;:true},&quot;cellMultiplier&quot;:{&quot;XL&quot;:1,&quot;LG&quot;:1,&quot;MD&quot;:0.9347826086956521,&quot;SM&quot;:1.3953488372093024,&quot;XS&quot;:1},&quot;canCollapse&quot;:{&quot;XL&quot;:false,&quot;LG&quot;:false,&quot;MD&quot;:true,&quot;SM&quot;:true,&quot;XS&quot;:true}}}\\\">\\n            <div class=\\\"u-block-9231-9 u-container-layout u-valign-middle\\\" style=\\\"padding-top: 30px; padding-bottom: 30px; padding-left: 60px; padding-right: 60px\\\" data-state=\\\"{&quot;min-height&quot;:{&quot;canCollapse&quot;:{&quot;XL&quot;:false,&quot;LG&quot;:false,&quot;MD&quot;:false,&quot;SM&quot;:false,&quot;XS&quot;:false}}}\\\">\\n              <h3 class=\\\"u-block-9231-6 u-text u-text-default\\\" style=\\\"margin-top: 0px; margin-right: 20px; margin-bottom: 0px;\\\">Cookies &amp; Privacy</h3>\\n              <p class=\\\"u-block-9231-5 u-text u-text-default\\\" style=\\\"margin: 8px 20px 0px 0px;\\\">This website uses cookies to ensure you get the best experience on our website.</p>\\n            </div>\\n          </div>\\n          <div class=\\\"u-align-left u-block-9231-10 u-container-style u-layout-cell u-right-cell u-size-14-lg u-size-14-xl u-size-17-md u-size-17-sm u-size-17-xs\\\" style=\\\"min-height: 152px\\\" data-state=\\\"{&quot;min-height&quot;:{&quot;expandedParent&quot;:{&quot;XL&quot;:true,&quot;LG&quot;:true,&quot;MD&quot;:true,&quot;SM&quot;:true,&quot;XS&quot;:true},&quot;cellMultiplier&quot;:{&quot;XL&quot;:1,&quot;LG&quot;:1,&quot;MD&quot;:1.2142857142857142,&quot;SM&quot;:3.5294117647058822,&quot;XS&quot;:1},&quot;canCollapse&quot;:{&quot;XL&quot;:false,&quot;LG&quot;:false,&quot;MD&quot;:true,&quot;SM&quot;:true,&quot;XS&quot;:true}}}\\\">\\n            <div class=\\\"u-block-9231-11 u-container-layout u-valign-middle-lg u-valign-middle-md u-valign-middle-xl u-valign-top-sm u-valign-top-xs\\\" style=\\\"padding-top: 30px; padding-bottom: 30px; padding-left: 30px; padding-right: 30px\\\" data-state=\\\"{&quot;min-height&quot;:{&quot;canCollapse&quot;:{&quot;XL&quot;:false,&quot;LG&quot;:false,&quot;MD&quot;:false,&quot;SM&quot;:false,&quot;XS&quot;:false}}}\\\">\\n              <a href=\\\"###\\\" class=\\\"u-block-9231-3 u-btn u-button-confirm u-button-style u-palette-1-base\\\" style=\\\"margin-top: 0px; margin-right: auto; margin-bottom: 0px; margin-left: 0px\\\">Confirm</a>\\n            </div>\\n          </div>\\n        </div>\\n      </div>\\n    </div>\\n  </div>\\n  <style data-mode=\\\"XL\\\">@media (max-width: 0px) { .u-block-9231-1 {background-image: none}\\n.u-block-9231-2 {min-height: 212px}\\n.u-block-9231-7 {margin-top: 30px; margin-bottom: 30px}\\n.u-block-9231-8 {min-height: 152px}\\n.u-block-9231-9 {padding-top: 30px; padding-bottom: 30px; padding-left: 60px; padding-right: 60px}\\n.u-block-9231-6 {margin-top: 0px; margin-right: 20px; margin-bottom: 0px}\\n.u-block-9231-5 {margin-top: 8px; margin-right: 20px; margin-bottom: 0px; margin-left: 0px}\\n.u-block-9231-10 {min-height: 152px}\\n.u-block-9231-11 {padding-top: 30px; padding-bottom: 30px; padding-left: 30px; padding-right: 30px}\\n.u-block-9231-3 {margin-top: 0px; margin-right: auto; margin-bottom: 0px; margin-left: 0px} }</style>\\n  <style data-mode=\\\"LG\\\">@media (max-width: 0px) { .u-block-9231-1 {background-image: none}\\n.u-block-9231-2 {min-height: 131px}\\n.u-block-9231-7 {margin-top: 30px; margin-bottom: 30px}\\n.u-block-9231-8 {min-height: 125px}\\n.u-block-9231-9 {padding-top: 30px; padding-bottom: 30px; padding-left: 60px; padding-right: 60px}\\n.u-block-9231-6 {margin-top: 0px; margin-right: 0px; margin-bottom: 0px}\\n.u-block-9231-5 {margin-top: 8px; margin-right: 0px; margin-bottom: 0px; margin-left: 0px}\\n.u-block-9231-10 {min-height: 125px}\\n.u-block-9231-11 {padding-top: 30px; padding-bottom: 30px; padding-left: 30px; padding-right: 30px}\\n.u-block-9231-3 {margin-top: 0px; margin-right: auto; margin-bottom: 0px; margin-left: 0px} }</style>\\n  <style data-mode=\\\"MD\\\" data-visited=\\\"true\\\">@media (max-width: 0px) { .u-block-9231-1 {background-image: none}\\n.u-block-9231-2 {min-height: 106px}\\n.u-block-9231-7 {margin-top: 30px; margin-bottom: 30px}\\n.u-block-9231-8 {min-height: 100px}\\n.u-block-9231-9 {padding-top: 30px; padding-bottom: 30px; padding-left: 30px; padding-right: 30px}\\n.u-block-9231-6 {margin-top: 0px; margin-right: 0px; margin-bottom: 0px}\\n.u-block-9231-5 {margin-top: 8px; margin-right: 0px; margin-bottom: 0px; margin-left: 0px}\\n.u-block-9231-10 {min-height: 100px}\\n.u-block-9231-11 {padding-top: 30px; padding-bottom: 30px; padding-left: 30px; padding-right: 30px}\\n.u-block-9231-3 {margin-top: 0px; margin-right: auto; margin-bottom: 0px; margin-left: 0px} }</style>\\n  <style data-mode=\\\"SM\\\" data-visited=\\\"true\\\">@media (max-width: 0px) { .u-block-9231-1 {background-image: none}\\n.u-block-9231-2 {min-height: 225px}\\n.u-block-9231-7 {margin-top: 30px; margin-bottom: 30px}\\n.u-block-9231-8 {min-height: 154px}\\n.u-block-9231-9 {padding-top: 30px; padding-left: 10px; padding-right: 10px; padding-bottom: 20px}\\n.u-block-9231-6 {margin-top: 0px; margin-right: 0px; margin-bottom: 0px}\\n.u-block-9231-5 {margin-top: 8px; margin-right: 0px; margin-bottom: 0px; margin-left: 0px}\\n.u-block-9231-10 {min-height: 65px}\\n.u-block-9231-11 {padding-top: 10px; padding-bottom: 10px; padding-left: 10px; padding-right: 10px}\\n.u-block-9231-3 {margin-top: 0px; margin-right: auto; margin-bottom: 0px; margin-left: 0px} }</style>\\n  <style data-mode=\\\"XS\\\" data-visited=\\\"true\\\">@media (max-width: 0px) { .u-block-9231-1 {background-image: none}\\n.u-block-9231-2 {min-height: 121px}\\n.u-block-9231-7 {margin-top: 30px; margin-bottom: 30px}\\n.u-block-9231-8 {min-height: 100px}\\n.u-block-9231-9 {padding-top: 30px; padding-bottom: 20px; padding-left: 10px; padding-right: 10px}\\n.u-block-9231-6 {margin-top: 0px; margin-right: 0px; margin-bottom: 0px}\\n.u-block-9231-5 {margin-top: 8px; margin-right: 0px; margin-bottom: 0px; margin-left: 0px}\\n.u-block-9231-10 {min-height: 15px}\\n.u-block-9231-11 {padding-top: 10px; padding-bottom: 10px; padding-left: 10px; padding-right: 10px}\\n.u-block-9231-3 {margin-top: 0px; margin-right: auto; margin-bottom: 0px; margin-left: 0px} }</style>\\n</section>\"}","title":"Site2","siteStyleCss":"<style id=\"color-scheme\" color-scheme=\"u11\" color-style=\"multicolor-1\">.u-body {\n--none: transparent;\n--none-darker: transparent;\n--none-r: 255;\n--none-g: 255;\n--none-b: 255;\n--none-contrast: body-color;\n--none-contrast-darker: body-color;\n--none-text-color: var(--body-color);\n--transparent: transparent;\n--transparent-darker: transparent;\n--transparent-r: 255;\n--transparent-g: 255;\n--transparent-b: 255;\n--transparent-contrast: body-color;\n--transparent-contrast-darker: body-color;\n--transparent-text-color: var(--body-color);\n--body-color: #111111;\n--body-color-darker: #0f0f0f;\n--body-color-r: 17;\n--body-color-g: 17;\n--body-color-b: 17;\n--body-color-contrast: white;\n--body-color-contrast-darker: white;\n--body-color-text-color: var(--body-alt-color);\n--body-alt-color: #ffffff;\n--body-alt-color-darker: #e6e6e6;\n--body-alt-color-r: 255;\n--body-alt-color-g: 255;\n--body-alt-color-b: 255;\n--body-alt-color-contrast: black;\n--body-alt-color-contrast-darker: black;\n--body-alt-color-text-color: var(--body-color);\n--bg-color: #ffffff;\n--bg-color-darker: #e6e6e6;\n--bg-color-r: 255;\n--bg-color-g: 255;\n--bg-color-b: 255;\n--bg-color-contrast: black;\n--bg-color-contrast-darker: black;\n--bg-color-text-color: var(--body-color);\n--palette-1-base: #e3b377;\n--palette-1-base-darker: #dda35a;\n--palette-1-base-r: 227;\n--palette-1-base-g: 179;\n--palette-1-base-b: 119;\n--palette-1-base-contrast: white;\n--palette-1-base-contrast-darker: white;\n--palette-1-base-text-color: var(--body-alt-color);\n--palette-1-dark-3: #332e29;\n--palette-1-dark-3-darker: #2e2925;\n--palette-1-dark-3-r: 51;\n--palette-1-dark-3-g: 46;\n--palette-1-dark-3-b: 41;\n--palette-1-dark-3-contrast: white;\n--palette-1-dark-3-contrast-darker: white;\n--palette-1-dark-3-text-color: var(--body-alt-color);\n--palette-1-dark-2: #6e5f4e;\n--palette-1-dark-2-darker: #635646;\n--palette-1-dark-2-r: 110;\n--palette-1-dark-2-g: 95;\n--palette-1-dark-2-b: 78;\n--palette-1-dark-2-contrast: white;\n--palette-1-dark-2-contrast-darker: white;\n--palette-1-dark-2-text-color: var(--body-alt-color);\n--palette-1-dark-1: #a88c68;\n--palette-1-dark-1-darker: #9b7f59;\n--palette-1-dark-1-r: 168;\n--palette-1-dark-1-g: 140;\n--palette-1-dark-1-b: 104;\n--palette-1-dark-1-contrast: white;\n--palette-1-dark-1-contrast-darker: white;\n--palette-1-dark-1-text-color: var(--body-alt-color);\n--palette-1: #e3b377;\n--palette-1-darker: #dda35a;\n--palette-1-r: 227;\n--palette-1-g: 179;\n--palette-1-b: 119;\n--palette-1-contrast: white;\n--palette-1-contrast-darker: white;\n--palette-1-text-color: var(--body-alt-color);\n--palette-1-light-1: #ebc99d;\n--palette-1-light-1-darker: #e4b77c;\n--palette-1-light-1-r: 235;\n--palette-1-light-1-g: 201;\n--palette-1-light-1-b: 157;\n--palette-1-light-1-contrast: black;\n--palette-1-light-1-contrast-darker: black;\n--palette-1-light-1-text-color: var(--body-color);\n--palette-1-light-2: #f4dfc5;\n--palette-1-light-2-darker: #edcba0;\n--palette-1-light-2-r: 244;\n--palette-1-light-2-g: 223;\n--palette-1-light-2-b: 197;\n--palette-1-light-2-contrast: black;\n--palette-1-light-2-contrast-darker: black;\n--palette-1-light-2-text-color: var(--body-color);\n--palette-1-light-3: #fcf7f0;\n--palette-1-light-3-darker: #f4e1c7;\n--palette-1-light-3-r: 252;\n--palette-1-light-3-g: 247;\n--palette-1-light-3-b: 240;\n--palette-1-light-3-contrast: black;\n--palette-1-light-3-contrast-darker: black;\n--palette-1-light-3-text-color: var(--body-color);\n--palette-2-base: #e5492c;\n--palette-2-base-darker: #db391b;\n--palette-2-base-r: 229;\n--palette-2-base-g: 73;\n--palette-2-base-b: 44;\n--palette-2-base-contrast: white;\n--palette-2-base-contrast-darker: white;\n--palette-2-base-text-color: var(--body-alt-color);\n--palette-2-dark-3: #332a29;\n--palette-2-dark-3-darker: #2e2625;\n--palette-2-dark-3-r: 51;\n--palette-2-dark-3-g: 42;\n--palette-2-dark-3-b: 41;\n--palette-2-dark-3-contrast: white;\n--palette-2-dark-3-contrast-darker: white;\n--palette-2-dark-3-text-color: var(--body-alt-color);\n--palette-2-dark-2: #6e4942;\n--palette-2-dark-2-darker: #63423b;\n--palette-2-dark-2-r: 110;\n--palette-2-dark-2-g: 73;\n--palette-2-dark-2-b: 66;\n--palette-2-dark-2-contrast: white;\n--palette-2-dark-2-contrast-darker: white;\n--palette-2-dark-2-text-color: var(--body-alt-color);\n--palette-2-dark-1: #aa5343;\n--palette-2-dark-1-darker: #994b3c;\n--palette-2-dark-1-r: 170;\n--palette-2-dark-1-g: 83;\n--palette-2-dark-1-b: 67;\n--palette-2-dark-1-contrast: white;\n--palette-2-dark-1-contrast-darker: white;\n--palette-2-dark-1-text-color: var(--body-alt-color);\n--palette-2: #e5492c;\n--palette-2-darker: #db391b;\n--palette-2-r: 229;\n--palette-2-g: 73;\n--palette-2-b: 44;\n--palette-2-contrast: white;\n--palette-2-contrast-darker: white;\n--palette-2-text-color: var(--body-alt-color);\n--palette-2-light-1: #ed7c67;\n--palette-2-light-1-darker: #e96249;\n--palette-2-light-1-r: 237;\n--palette-2-light-1-g: 124;\n--palette-2-light-1-b: 103;\n--palette-2-light-1-contrast: white;\n--palette-2-light-1-contrast-darker: white;\n--palette-2-light-1-text-color: var(--body-alt-color);\n--palette-2-light-2: #f5b2a6;\n--palette-2-light-2-darker: #f19281;\n--palette-2-light-2-r: 245;\n--palette-2-light-2-g: 178;\n--palette-2-light-2-b: 166;\n--palette-2-light-2-contrast: black;\n--palette-2-light-2-contrast-darker: white;\n--palette-2-light-2-text-color: var(--body-color);\n--palette-2-light-3: #fcebe8;\n--palette-2-light-3-darker: #f6c6bd;\n--palette-2-light-3-r: 252;\n--palette-2-light-3-g: 235;\n--palette-2-light-3-b: 232;\n--palette-2-light-3-contrast: black;\n--palette-2-light-3-contrast-darker: black;\n--palette-2-light-3-text-color: var(--body-color);\n--palette-3-base: #8bc9ba;\n--palette-3-base-darker: #74beac;\n--palette-3-base-r: 139;\n--palette-3-base-g: 201;\n--palette-3-base-b: 186;\n--palette-3-base-contrast: black;\n--palette-3-base-contrast-darker: white;\n--palette-3-base-text-color: var(--body-color);\n--palette-3-dark-3: #293331;\n--palette-3-dark-3-darker: #252e2c;\n--palette-3-dark-3-r: 41;\n--palette-3-dark-3-g: 51;\n--palette-3-dark-3-b: 49;\n--palette-3-dark-3-contrast: white;\n--palette-3-dark-3-contrast-darker: white;\n--palette-3-dark-3-text-color: var(--body-alt-color);\n--palette-3-dark-2: #4d655f;\n--palette-3-dark-2-darker: #455b56;\n--palette-3-dark-2-r: 77;\n--palette-3-dark-2-g: 101;\n--palette-3-dark-2-b: 95;\n--palette-3-dark-2-contrast: white;\n--palette-3-dark-2-contrast-darker: white;\n--palette-3-dark-2-text-color: var(--body-alt-color);\n--palette-3-dark-1: #6e978d;\n--palette-3-dark-1-darker: #62897f;\n--palette-3-dark-1-r: 110;\n--palette-3-dark-1-g: 151;\n--palette-3-dark-1-b: 141;\n--palette-3-dark-1-contrast: white;\n--palette-3-dark-1-contrast-darker: white;\n--palette-3-dark-1-text-color: var(--body-alt-color);\n--palette-3: #8bc9ba;\n--palette-3-darker: #74beac;\n--palette-3-r: 139;\n--palette-3-g: 201;\n--palette-3-b: 186;\n--palette-3-contrast: black;\n--palette-3-contrast-darker: white;\n--palette-3-text-color: var(--body-color);\n--palette-3-light-1: #aad9ce;\n--palette-3-light-1-darker: #8fcdbf;\n--palette-3-light-1-r: 170;\n--palette-3-light-1-g: 217;\n--palette-3-light-1-b: 206;\n--palette-3-light-1-contrast: black;\n--palette-3-light-1-contrast-darker: black;\n--palette-3-light-1-text-color: var(--body-color);\n--palette-3-light-2: #cde9e2;\n--palette-3-light-2-darker: #afdcd0;\n--palette-3-light-2-r: 205;\n--palette-3-light-2-g: 233;\n--palette-3-light-2-b: 226;\n--palette-3-light-2-contrast: black;\n--palette-3-light-2-contrast-darker: black;\n--palette-3-light-2-text-color: var(--body-color);\n--palette-3-light-3: #f2faf8;\n--palette-3-light-3-darker: #ceece5;\n--palette-3-light-3-r: 242;\n--palette-3-light-3-g: 250;\n--palette-3-light-3-b: 248;\n--palette-3-light-3-contrast: black;\n--palette-3-light-3-contrast-darker: black;\n--palette-3-light-3-text-color: var(--body-color);\n--palette-4-base: #f4e1cb;\n--palette-4-base-darker: #eccca6;\n--palette-4-base-r: 244;\n--palette-4-base-g: 225;\n--palette-4-base-b: 203;\n--palette-4-base-contrast: black;\n--palette-4-base-contrast-darker: black;\n--palette-4-base-text-color: var(--body-color);\n--palette-4-dark-3: #332e29;\n--palette-4-dark-3-darker: #2e2925;\n--palette-4-dark-3-r: 51;\n--palette-4-dark-3-g: 46;\n--palette-4-dark-3-b: 41;\n--palette-4-dark-3-contrast: white;\n--palette-4-dark-3-contrast-darker: white;\n--palette-4-dark-3-text-color: var(--body-alt-color);\n--palette-4-dark-2: #61574c;\n--palette-4-dark-2-darker: #574e44;\n--palette-4-dark-2-r: 97;\n--palette-4-dark-2-g: 87;\n--palette-4-dark-2-b: 76;\n--palette-4-dark-2-contrast: white;\n--palette-4-dark-2-contrast-darker: white;\n--palette-4-dark-2-text-color: var(--body-alt-color);\n--palette-4-dark-1: #907f6c;\n--palette-4-dark-1-darker: #827261;\n--palette-4-dark-1-r: 144;\n--palette-4-dark-1-g: 127;\n--palette-4-dark-1-b: 108;\n--palette-4-dark-1-contrast: white;\n--palette-4-dark-1-contrast-darker: white;\n--palette-4-dark-1-text-color: var(--body-alt-color);\n--palette-4: #bea68a;\n--palette-4-darker: #b29675;\n--palette-4-r: 190;\n--palette-4-g: 166;\n--palette-4-b: 138;\n--palette-4-contrast: white;\n--palette-4-contrast-darker: white;\n--palette-4-text-color: var(--body-alt-color);\n--palette-4-light-1: #d9c3a9;\n--palette-4-light-1-darker: #cdb08e;\n--palette-4-light-1-r: 217;\n--palette-4-light-1-g: 195;\n--palette-4-light-1-b: 169;\n--palette-4-light-1-contrast: black;\n--palette-4-light-1-contrast-darker: white;\n--palette-4-light-1-text-color: var(--body-color);\n--palette-4-light-2: #f4e1cb;\n--palette-4-light-2-darker: #eccca6;\n--palette-4-light-2-r: 244;\n--palette-4-light-2-g: 225;\n--palette-4-light-2-b: 203;\n--palette-4-light-2-contrast: black;\n--palette-4-light-2-contrast-darker: black;\n--palette-4-light-2-text-color: var(--body-color);\n--palette-4-light-3: #fefcf9;\n--palette-4-light-3-darker: #f7e6ce;\n--palette-4-light-3-r: 254;\n--palette-4-light-3-g: 252;\n--palette-4-light-3-b: 249;\n--palette-4-light-3-contrast: black;\n--palette-4-light-3-contrast-darker: black;\n--palette-4-light-3-text-color: var(--body-color);\n--palette-5-base: #dddbd9;\n--palette-5-base-darker: #c8c5c2;\n--palette-5-base-r: 221;\n--palette-5-base-g: 219;\n--palette-5-base-b: 217;\n--palette-5-base-contrast: black;\n--palette-5-base-contrast-darker: black;\n--palette-5-base-text-color: var(--body-color);\n--palette-5-dark-3: #332e29;\n--palette-5-dark-3-darker: #2e2925;\n--palette-5-dark-3-r: 51;\n--palette-5-dark-3-g: 46;\n--palette-5-dark-3-b: 41;\n--palette-5-dark-3-contrast: white;\n--palette-5-dark-3-contrast-darker: white;\n--palette-5-dark-3-text-color: var(--body-alt-color);\n--palette-5-dark-2: #61564c;\n--palette-5-dark-2-darker: #574d44;\n--palette-5-dark-2-r: 97;\n--palette-5-dark-2-g: 86;\n--palette-5-dark-2-b: 76;\n--palette-5-dark-2-contrast: white;\n--palette-5-dark-2-contrast-darker: white;\n--palette-5-dark-2-text-color: var(--body-alt-color);\n--palette-5-dark-1: #8e7e6d;\n--palette-5-dark-1-darker: #807162;\n--palette-5-dark-1-r: 142;\n--palette-5-dark-1-g: 126;\n--palette-5-dark-1-b: 109;\n--palette-5-dark-1-contrast: white;\n--palette-5-dark-1-contrast-darker: white;\n--palette-5-dark-1-text-color: var(--body-alt-color);\n--palette-5: #bca58e;\n--palette-5-darker: #b09579;\n--palette-5-r: 188;\n--palette-5-g: 165;\n--palette-5-b: 142;\n--palette-5-contrast: white;\n--palette-5-contrast-darker: white;\n--palette-5-text-color: var(--body-alt-color);\n--palette-5-light-1: #ccbfb1;\n--palette-5-light-1-darker: #bdac9a;\n--palette-5-light-1-r: 204;\n--palette-5-light-1-g: 191;\n--palette-5-light-1-b: 177;\n--palette-5-light-1-contrast: black;\n--palette-5-light-1-contrast-darker: white;\n--palette-5-light-1-text-color: var(--body-color);\n--palette-5-light-2: #dddbd9;\n--palette-5-light-2-darker: #c8c5c2;\n--palette-5-light-2-r: 221;\n--palette-5-light-2-g: 219;\n--palette-5-light-2-b: 217;\n--palette-5-light-2-contrast: black;\n--palette-5-light-2-contrast-darker: black;\n--palette-5-light-2-text-color: var(--body-color);\n--palette-5-light-3: #fcf9f7;\n--palette-5-light-3-darker: #eeded3;\n--palette-5-light-3-r: 252;\n--palette-5-light-3-g: 249;\n--palette-5-light-3-b: 247;\n--palette-5-light-3-contrast: black;\n--palette-5-light-3-contrast-darker: black;\n--palette-5-light-3-text-color: var(--body-color);\n--grey-40: #999999;\n--grey-40-darker: #8a8a8a;\n--grey-40-r: 153;\n--grey-40-g: 153;\n--grey-40-b: 153;\n--grey-40-contrast: white;\n--grey-40-contrast-darker: white;\n--grey-40-text-color: var(--body-alt-color);\n--grey-30: #b3b3b3;\n--grey-30-darker: #a1a1a1;\n--grey-30-r: 179;\n--grey-30-g: 179;\n--grey-30-b: 179;\n--grey-30-contrast: white;\n--grey-30-contrast-darker: white;\n--grey-30-text-color: var(--body-alt-color);\n--grey-25: #c0c0c0;\n--grey-25-darker: #adadad;\n--grey-25-r: 192;\n--grey-25-g: 192;\n--grey-25-b: 192;\n--grey-25-contrast: black;\n--grey-25-contrast-darker: white;\n--grey-25-text-color: var(--body-color);\n--white: #ffffff;\n--white-darker: #e6e6e6;\n--white-r: 255;\n--white-g: 255;\n--white-b: 255;\n--white-contrast: black;\n--white-contrast-darker: black;\n--white-text-color: var(--body-color);\n--grey-15: #d9d9d9;\n--grey-15-darker: #c3c3c3;\n--grey-15-r: 217;\n--grey-15-g: 217;\n--grey-15-b: 217;\n--grey-15-contrast: black;\n--grey-15-contrast-darker: black;\n--grey-15-text-color: var(--body-color);\n--grey-10: #e5e5e5;\n--grey-10-darker: #cecece;\n--grey-10-r: 229;\n--grey-10-g: 229;\n--grey-10-b: 229;\n--grey-10-contrast: black;\n--grey-10-contrast-darker: black;\n--grey-10-text-color: var(--body-color);\n--grey-5: #f2f2f2;\n--grey-5-darker: #dadada;\n--grey-5-r: 242;\n--grey-5-g: 242;\n--grey-5-b: 242;\n--grey-5-contrast: black;\n--grey-5-contrast-darker: black;\n--grey-5-text-color: var(--body-color);\n--grey-90: #1a1a1a;\n--grey-90-darker: #171717;\n--grey-90-r: 26;\n--grey-90-g: 26;\n--grey-90-b: 26;\n--grey-90-contrast: white;\n--grey-90-contrast-darker: white;\n--grey-90-text-color: var(--body-alt-color);\n--grey-80: #333333;\n--grey-80-darker: #2e2e2e;\n--grey-80-r: 51;\n--grey-80-g: 51;\n--grey-80-b: 51;\n--grey-80-contrast: white;\n--grey-80-contrast-darker: white;\n--grey-80-text-color: var(--body-alt-color);\n--grey-75: #404040;\n--grey-75-darker: #3a3a3a;\n--grey-75-r: 64;\n--grey-75-g: 64;\n--grey-75-b: 64;\n--grey-75-contrast: white;\n--grey-75-contrast-darker: white;\n--grey-75-text-color: var(--body-alt-color);\n--black: #000000;\n--black-darker: #000000;\n--black-r: 0;\n--black-g: 0;\n--black-b: 0;\n--black-contrast: white;\n--black-contrast-darker: white;\n--black-text-color: var(--body-alt-color);\n--grey-70: #4d4d4d;\n--grey-70-darker: #454545;\n--grey-70-r: 77;\n--grey-70-g: 77;\n--grey-70-b: 77;\n--grey-70-contrast: white;\n--grey-70-contrast-darker: white;\n--grey-70-text-color: var(--body-alt-color);\n--grey-60: #666666;\n--grey-60-darker: #5c5c5c;\n--grey-60-r: 102;\n--grey-60-g: 102;\n--grey-60-b: 102;\n--grey-60-contrast: white;\n--grey-60-contrast-darker: white;\n--grey-60-text-color: var(--body-alt-color);\n--grey-50: #808080;\n--grey-50-darker: #737373;\n--grey-50-r: 128;\n--grey-50-g: 128;\n--grey-50-b: 128;\n--grey-50-contrast: white;\n--grey-50-contrast-darker: white;\n--grey-50-text-color: var(--body-alt-color);\n--grey-dark-3: #212121;\n--grey-dark-3-darker: #1e1e1e;\n--grey-dark-3-r: 33;\n--grey-dark-3-g: 33;\n--grey-dark-3-b: 33;\n--grey-dark-3-contrast: white;\n--grey-dark-3-contrast-darker: white;\n--grey-dark-3-text-color: var(--body-alt-color);\n--grey-dark-2: #333333;\n--grey-dark-2-darker: #2e2e2e;\n--grey-dark-2-r: 51;\n--grey-dark-2-g: 51;\n--grey-dark-2-b: 51;\n--grey-dark-2-contrast: white;\n--grey-dark-2-contrast-darker: white;\n--grey-dark-2-text-color: var(--body-alt-color);\n--grey-dark-1: #454545;\n--grey-dark-1-darker: #3e3e3e;\n--grey-dark-1-r: 69;\n--grey-dark-1-g: 69;\n--grey-dark-1-b: 69;\n--grey-dark-1-contrast: white;\n--grey-dark-1-contrast-darker: white;\n--grey-dark-1-text-color: var(--body-alt-color);\n--grey: #b3b3b3;\n--grey-darker: #a1a1a1;\n--grey-r: 179;\n--grey-g: 179;\n--grey-b: 179;\n--grey-contrast: white;\n--grey-contrast-darker: white;\n--grey-text-color: var(--body-alt-color);\n--grey-light-1: #d9d9d9;\n--grey-light-1-darker: #c3c3c3;\n--grey-light-1-r: 217;\n--grey-light-1-g: 217;\n--grey-light-1-b: 217;\n--grey-light-1-contrast: black;\n--grey-light-1-contrast-darker: black;\n--grey-light-1-text-color: var(--body-color);\n--grey-light-2: #eeeeee;\n--grey-light-2-darker: #d6d6d6;\n--grey-light-2-r: 238;\n--grey-light-2-g: 238;\n--grey-light-2-b: 238;\n--grey-light-2-contrast: black;\n--grey-light-2-contrast-darker: black;\n--grey-light-2-text-color: var(--body-color);\n--grey-light-3: #f6f6f6;\n--grey-light-3-darker: #dddddd;\n--grey-light-3-r: 246;\n--grey-light-3-g: 246;\n--grey-light-3-b: 246;\n--grey-light-3-contrast: black;\n--grey-light-3-contrast-darker: black;\n--grey-light-3-text-color: var(--body-color);\n--color-1-base: #e3b377;\n--color-1-base-darker: #dda35a;\n--color-1-base-r: 227;\n--color-1-base-g: 179;\n--color-1-base-b: 119;\n--color-1-base-contrast: white;\n--color-1-base-contrast-darker: white;\n--color-1-base-text-color: var(--body-alt-color);\n--color-1-dark-3: #332e29;\n--color-1-dark-3-darker: #2e2925;\n--color-1-dark-3-r: 51;\n--color-1-dark-3-g: 46;\n--color-1-dark-3-b: 41;\n--color-1-dark-3-contrast: white;\n--color-1-dark-3-contrast-darker: white;\n--color-1-dark-3-text-color: var(--body-alt-color);\n--color-1-dark-2: #6e5f4e;\n--color-1-dark-2-darker: #635646;\n--color-1-dark-2-r: 110;\n--color-1-dark-2-g: 95;\n--color-1-dark-2-b: 78;\n--color-1-dark-2-contrast: white;\n--color-1-dark-2-contrast-darker: white;\n--color-1-dark-2-text-color: var(--body-alt-color);\n--color-1-dark-1: #a88c68;\n--color-1-dark-1-darker: #9b7f59;\n--color-1-dark-1-r: 168;\n--color-1-dark-1-g: 140;\n--color-1-dark-1-b: 104;\n--color-1-dark-1-contrast: white;\n--color-1-dark-1-contrast-darker: white;\n--color-1-dark-1-text-color: var(--body-alt-color);\n--color-1: #e3b377;\n--color-1-darker: #dda35a;\n--color-1-r: 227;\n--color-1-g: 179;\n--color-1-b: 119;\n--color-1-contrast: white;\n--color-1-contrast-darker: white;\n--color-1-text-color: var(--body-alt-color);\n--color-1-light-1: #ebc99d;\n--color-1-light-1-darker: #e4b77c;\n--color-1-light-1-r: 235;\n--color-1-light-1-g: 201;\n--color-1-light-1-b: 157;\n--color-1-light-1-contrast: black;\n--color-1-light-1-contrast-darker: black;\n--color-1-light-1-text-color: var(--body-color);\n--color-1-light-2: #f4dfc5;\n--color-1-light-2-darker: #edcba0;\n--color-1-light-2-r: 244;\n--color-1-light-2-g: 223;\n--color-1-light-2-b: 197;\n--color-1-light-2-contrast: black;\n--color-1-light-2-contrast-darker: black;\n--color-1-light-2-text-color: var(--body-color);\n--color-1-light-3: #fcf7f0;\n--color-1-light-3-darker: #f4e1c7;\n--color-1-light-3-r: 252;\n--color-1-light-3-g: 247;\n--color-1-light-3-b: 240;\n--color-1-light-3-contrast: black;\n--color-1-light-3-contrast-darker: black;\n--color-1-light-3-text-color: var(--body-color);\n--color-2-base: #e5492c;\n--color-2-base-darker: #db391b;\n--color-2-base-r: 229;\n--color-2-base-g: 73;\n--color-2-base-b: 44;\n--color-2-base-contrast: white;\n--color-2-base-contrast-darker: white;\n--color-2-base-text-color: var(--body-alt-color);\n--color-2-dark-3: #332a29;\n--color-2-dark-3-darker: #2e2625;\n--color-2-dark-3-r: 51;\n--color-2-dark-3-g: 42;\n--color-2-dark-3-b: 41;\n--color-2-dark-3-contrast: white;\n--color-2-dark-3-contrast-darker: white;\n--color-2-dark-3-text-color: var(--body-alt-color);\n--color-2-dark-2: #6e4942;\n--color-2-dark-2-darker: #63423b;\n--color-2-dark-2-r: 110;\n--color-2-dark-2-g: 73;\n--color-2-dark-2-b: 66;\n--color-2-dark-2-contrast: white;\n--color-2-dark-2-contrast-darker: white;\n--color-2-dark-2-text-color: var(--body-alt-color);\n--color-2-dark-1: #aa5343;\n--color-2-dark-1-darker: #994b3c;\n--color-2-dark-1-r: 170;\n--color-2-dark-1-g: 83;\n--color-2-dark-1-b: 67;\n--color-2-dark-1-contrast: white;\n--color-2-dark-1-contrast-darker: white;\n--color-2-dark-1-text-color: var(--body-alt-color);\n--color-2: #e5492c;\n--color-2-darker: #db391b;\n--color-2-r: 229;\n--color-2-g: 73;\n--color-2-b: 44;\n--color-2-contrast: white;\n--color-2-contrast-darker: white;\n--color-2-text-color: var(--body-alt-color);\n--color-2-light-1: #ed7c67;\n--color-2-light-1-darker: #e96249;\n--color-2-light-1-r: 237;\n--color-2-light-1-g: 124;\n--color-2-light-1-b: 103;\n--color-2-light-1-contrast: white;\n--color-2-light-1-contrast-darker: white;\n--color-2-light-1-text-color: var(--body-alt-color);\n--color-2-light-2: #f5b2a6;\n--color-2-light-2-darker: #f19281;\n--color-2-light-2-r: 245;\n--color-2-light-2-g: 178;\n--color-2-light-2-b: 166;\n--color-2-light-2-contrast: black;\n--color-2-light-2-contrast-darker: white;\n--color-2-light-2-text-color: var(--body-color);\n--color-2-light-3: #fcebe8;\n--color-2-light-3-darker: #f6c6bd;\n--color-2-light-3-r: 252;\n--color-2-light-3-g: 235;\n--color-2-light-3-b: 232;\n--color-2-light-3-contrast: black;\n--color-2-light-3-contrast-darker: black;\n--color-2-light-3-text-color: var(--body-color);\n--color-3-base: #8bc9ba;\n--color-3-base-darker: #74beac;\n--color-3-base-r: 139;\n--color-3-base-g: 201;\n--color-3-base-b: 186;\n--color-3-base-contrast: black;\n--color-3-base-contrast-darker: white;\n--color-3-base-text-color: var(--body-color);\n--color-3-dark-3: #293331;\n--color-3-dark-3-darker: #252e2c;\n--color-3-dark-3-r: 41;\n--color-3-dark-3-g: 51;\n--color-3-dark-3-b: 49;\n--color-3-dark-3-contrast: white;\n--color-3-dark-3-contrast-darker: white;\n--color-3-dark-3-text-color: var(--body-alt-color);\n--color-3-dark-2: #4d655f;\n--color-3-dark-2-darker: #455b56;\n--color-3-dark-2-r: 77;\n--color-3-dark-2-g: 101;\n--color-3-dark-2-b: 95;\n--color-3-dark-2-contrast: white;\n--color-3-dark-2-contrast-darker: white;\n--color-3-dark-2-text-color: var(--body-alt-color);\n--color-3-dark-1: #6e978d;\n--color-3-dark-1-darker: #62897f;\n--color-3-dark-1-r: 110;\n--color-3-dark-1-g: 151;\n--color-3-dark-1-b: 141;\n--color-3-dark-1-contrast: white;\n--color-3-dark-1-contrast-darker: white;\n--color-3-dark-1-text-color: var(--body-alt-color);\n--color-3: #8bc9ba;\n--color-3-darker: #74beac;\n--color-3-r: 139;\n--color-3-g: 201;\n--color-3-b: 186;\n--color-3-contrast: black;\n--color-3-contrast-darker: white;\n--color-3-text-color: var(--body-color);\n--color-3-light-1: #aad9ce;\n--color-3-light-1-darker: #8fcdbf;\n--color-3-light-1-r: 170;\n--color-3-light-1-g: 217;\n--color-3-light-1-b: 206;\n--color-3-light-1-contrast: black;\n--color-3-light-1-contrast-darker: black;\n--color-3-light-1-text-color: var(--body-color);\n--color-3-light-2: #cde9e2;\n--color-3-light-2-darker: #afdcd0;\n--color-3-light-2-r: 205;\n--color-3-light-2-g: 233;\n--color-3-light-2-b: 226;\n--color-3-light-2-contrast: black;\n--color-3-light-2-contrast-darker: black;\n--color-3-light-2-text-color: var(--body-color);\n--color-3-light-3: #f2faf8;\n--color-3-light-3-darker: #ceece5;\n--color-3-light-3-r: 242;\n--color-3-light-3-g: 250;\n--color-3-light-3-b: 248;\n--color-3-light-3-contrast: black;\n--color-3-light-3-contrast-darker: black;\n--color-3-light-3-text-color: var(--body-color);\n--color-4-base: #f4e1cb;\n--color-4-base-darker: #eccca6;\n--color-4-base-r: 244;\n--color-4-base-g: 225;\n--color-4-base-b: 203;\n--color-4-base-contrast: black;\n--color-4-base-contrast-darker: black;\n--color-4-base-text-color: var(--body-color);\n--color-4-dark-3: #332e29;\n--color-4-dark-3-darker: #2e2925;\n--color-4-dark-3-r: 51;\n--color-4-dark-3-g: 46;\n--color-4-dark-3-b: 41;\n--color-4-dark-3-contrast: white;\n--color-4-dark-3-contrast-darker: white;\n--color-4-dark-3-text-color: var(--body-alt-color);\n--color-4-dark-2: #61574c;\n--color-4-dark-2-darker: #574e44;\n--color-4-dark-2-r: 97;\n--color-4-dark-2-g: 87;\n--color-4-dark-2-b: 76;\n--color-4-dark-2-contrast: white;\n--color-4-dark-2-contrast-darker: white;\n--color-4-dark-2-text-color: var(--body-alt-color);\n--color-4-dark-1: #907f6c;\n--color-4-dark-1-darker: #827261;\n--color-4-dark-1-r: 144;\n--color-4-dark-1-g: 127;\n--color-4-dark-1-b: 108;\n--color-4-dark-1-contrast: white;\n--color-4-dark-1-contrast-darker: white;\n--color-4-dark-1-text-color: var(--body-alt-color);\n--color-4: #bea68a;\n--color-4-darker: #b29675;\n--color-4-r: 190;\n--color-4-g: 166;\n--color-4-b: 138;\n--color-4-contrast: white;\n--color-4-contrast-darker: white;\n--color-4-text-color: var(--body-alt-color);\n--color-4-light-1: #d9c3a9;\n--color-4-light-1-darker: #cdb08e;\n--color-4-light-1-r: 217;\n--color-4-light-1-g: 195;\n--color-4-light-1-b: 169;\n--color-4-light-1-contrast: black;\n--color-4-light-1-contrast-darker: white;\n--color-4-light-1-text-color: var(--body-color);\n--color-4-light-2: #f4e1cb;\n--color-4-light-2-darker: #eccca6;\n--color-4-light-2-r: 244;\n--color-4-light-2-g: 225;\n--color-4-light-2-b: 203;\n--color-4-light-2-contrast: black;\n--color-4-light-2-contrast-darker: black;\n--color-4-light-2-text-color: var(--body-color);\n--color-4-light-3: #fefcf9;\n--color-4-light-3-darker: #f7e6ce;\n--color-4-light-3-r: 254;\n--color-4-light-3-g: 252;\n--color-4-light-3-b: 249;\n--color-4-light-3-contrast: black;\n--color-4-light-3-contrast-darker: black;\n--color-4-light-3-text-color: var(--body-color);\n--color-5-base: #dddbd9;\n--color-5-base-darker: #c8c5c2;\n--color-5-base-r: 221;\n--color-5-base-g: 219;\n--color-5-base-b: 217;\n--color-5-base-contrast: black;\n--color-5-base-contrast-darker: black;\n--color-5-base-text-color: var(--body-color);\n--color-5-dark-3: #332e29;\n--color-5-dark-3-darker: #2e2925;\n--color-5-dark-3-r: 51;\n--color-5-dark-3-g: 46;\n--color-5-dark-3-b: 41;\n--color-5-dark-3-contrast: white;\n--color-5-dark-3-contrast-darker: white;\n--color-5-dark-3-text-color: var(--body-alt-color);\n--color-5-dark-2: #61564c;\n--color-5-dark-2-darker: #574d44;\n--color-5-dark-2-r: 97;\n--color-5-dark-2-g: 86;\n--color-5-dark-2-b: 76;\n--color-5-dark-2-contrast: white;\n--color-5-dark-2-contrast-darker: white;\n--color-5-dark-2-text-color: var(--body-alt-color);\n--color-5-dark-1: #8e7e6d;\n--color-5-dark-1-darker: #807162;\n--color-5-dark-1-r: 142;\n--color-5-dark-1-g: 126;\n--color-5-dark-1-b: 109;\n--color-5-dark-1-contrast: white;\n--color-5-dark-1-contrast-darker: white;\n--color-5-dark-1-text-color: var(--body-alt-color);\n--color-5: #bca58e;\n--color-5-darker: #b09579;\n--color-5-r: 188;\n--color-5-g: 165;\n--color-5-b: 142;\n--color-5-contrast: white;\n--color-5-contrast-darker: white;\n--color-5-text-color: var(--body-alt-color);\n--color-5-light-1: #ccbfb1;\n--color-5-light-1-darker: #bdac9a;\n--color-5-light-1-r: 204;\n--color-5-light-1-g: 191;\n--color-5-light-1-b: 177;\n--color-5-light-1-contrast: black;\n--color-5-light-1-contrast-darker: white;\n--color-5-light-1-text-color: var(--body-color);\n--color-5-light-2: #dddbd9;\n--color-5-light-2-darker: #c8c5c2;\n--color-5-light-2-r: 221;\n--color-5-light-2-g: 219;\n--color-5-light-2-b: 217;\n--color-5-light-2-contrast: black;\n--color-5-light-2-contrast-darker: black;\n--color-5-light-2-text-color: var(--body-color);\n--color-5-light-3: #fcf9f7;\n--color-5-light-3-darker: #eeded3;\n--color-5-light-3-r: 252;\n--color-5-light-3-g: 249;\n--color-5-light-3-b: 247;\n--color-5-light-3-contrast: black;\n--color-5-light-3-contrast-darker: black;\n--color-5-light-3-text-color: var(--body-color);\n--white-contrast: var(--body-color);\n--shading-contrast: var(--body-alt-color);\n--bg-contrast: var(--body-color);\n}</style><style id=\"typography\" typography=\"custom-page-typography-9\">\n        .u-body\n        {\n        --title-font-weight: 700;\n        --title-line-height: 1.1;\n        --title-font-size: 3.75rem;\n        --title-margin-top: 20px;\n        --title-margin-bottom: 20px;\n        --title-color: var(--palette-5-dark-3);\n        --title-font-family: 'Playfair Display',serif;\n        --title-alt-text-color: var(--palette-5-light-2);\n        --subtitle-font-weight: 700;\n        --subtitle-line-height: 1.2;\n        --subtitle-font-size: 2.25rem;\n        --subtitle-margin-top: 20px;\n        --subtitle-margin-bottom: 20px;\n        --subtitle-color: var(--palette-5-dark-2);\n        --subtitle-alt-text-color: var(--palette-5-light-2);\n        --h1-line-height: 1.1;\n        --h1-font-size: 4.375rem;\n        --h1-margin-top: 20px;\n        --h1-margin-bottom: 20px;\n        --h1-color: var(--palette-5-dark-3);\n        --h1-font-weight: 700;\n        --h1-list-icon-spacing: 0.3;\n        --h1-list-icon-size: 0.8;\n        --h1-alt-text-color: var(--palette-5-light-2);\n        --h2-font-weight: 700;\n        --h2-line-height: 1.2;\n        --h2-font-size: 3.75rem;\n        --h2-margin-top: 20px;\n        --h2-margin-bottom: 20px;\n        --h2-color: var(--palette-5-dark-3);\n        --h2-alt-text-color: var(--palette-5-light-2);\n        --h3-line-height: 1.2;\n        --h3-font-size: 1.875rem;\n        --h3-margin-top: 20px;\n        --h3-margin-bottom: 20px;\n        --h3-color: var(--palette-2-base);\n        --h3-text-transform: uppercase;\n        --h3-font-family: Agbalumo;\n        --h3-letter-spacing: 2px;\n        --h3-font-weight: 700;\n        --h3-alt-text-color: var(--palette-2-light-2);\n        --h4-font-weight: 700;\n        --h4-line-height: 1.2;\n        --h4-font-size: 1.5rem;\n        --h4-margin-top: 20px;\n        --h4-margin-bottom: 20px;\n        --h4-color: var(--palette-5-dark-3);\n        --h4-alt-text-color: var(--palette-5-light-2);\n        --h5-line-height: 1.8;\n        --h5-font-size: 1.5rem;\n        --h5-margin-top: 20px;\n        --h5-margin-bottom: 20px;\n        --h5-color: var(--palette-5-dark-3);\n        --h5-font-weight: 700;\n        --h5-list-icon-spacing: 0.3;\n        --h5-list-icon-size: 0.8;\n        --h5-font-family: Montserrat,sans-serif;\n        --h5-alt-text-color: var(--palette-5-light-2);\n        --h6-font-weight: 700;\n        --h6-line-height: 1.2;\n        --h6-font-size: 1.125rem;\n        --h6-margin-top: 20px;\n        --h6-margin-bottom: 20px;\n        --h6-color: var(--palette-5-dark-3);\n        --h6-alt-text-color: var(--palette-5-light-2);\n        --largeText-font-weight: 400;\n        --largeText-line-height: 1.6;\n        --largeText-font-size: 1rem;\n        --largeText-margin-top: 20px;\n        --largeText-margin-bottom: 20px;\n        --largeText-color: var(--palette-5-dark-3);\n        --largeText-alt-text-color: var(--palette-5-light-2);\n        --text-line-height: 2.2;\n        --text-font-size: 1.25rem;\n        --text-margin-top: 20px;\n        --text-margin-bottom: 20px;\n        --text-font-family: Agbalumo;\n        --text-list-icon-spacing: 0.3;\n        --text-list-icon-size: 0.8;\n        --smallText-font-weight: 400;\n        --smallText-line-height: 1.6;\n        --smallText-font-size: 0.875rem;\n        --smallText-margin-top: 20px;\n        --smallText-margin-bottom: 20px;\n        --button-letter-spacing: 1px;\n        --button-font-size: 1rem;\n        --button-line-height: 1.4;\n        --button-margin-top: 20px;\n        --button-margin-bottom: 20px;\n        --button-text-transform: uppercase;\n        --button-border-top-style: none;\n        --button-border-left-style: none;\n        --button-border-right-style: none;\n        --button-border-bottom-style: none;\n        --button-borders: top right bottom left;\n        --button-border-radius: 6px;\n        --button-image-size: [object Object];\n        --button-image-fit: cover;\n        --button-image-zoom: 100;\n        --button-animation: [object Object];\n        --button-border-radius: 6px;\n        --button-background-color: var(--palette-1-dark-3);\n        --button-color: var(--white);\n        --button-alt-background-color: var(--palette-1-light-2);\n        --button-alt-color: var(--black);\n        --button-hover-background-color: var(--palette-1-dark-3-darker);\n        --button-hover-color: var(--white-darker);\n        --button-hover-alt-background-color: var(--palette-1-light-2-darker);\n        --button-hover-alt-color: var(--white);\n        --button-hover-background-color: var(--palette-1-dark-3-darker);\n        --button-hover-color: var(--white-darker);\n        --button-hover-alt-background-color: var(--palette-1-light-2-darker);\n        --button-hover-alt-color: var(--white);\n        --button-active-background-color: var(--palette-1-dark-3-darker);\n        --button-active-color: var(--white-darker);\n        --button-active-alt-background-color: var(--palette-1-light-2-darker);\n        --button-active-alt-color: var(--white);\n        --blockquote-font-style: italic;\n        --blockquote-line-height: 1.6;\n        --blockquote-font-size: 1.25rem;\n        --blockquote-padding-left: 20px;\n        --blockquote-border-width: 4px;\n        --blockquote-border-color: var(--palette-1-base);\n        --blockquote-margin-top: 20px;\n        --blockquote-margin-bottom: 20px;\n        --blockquote-border-style: solid;\n        --metadata-font-size: 0.75rem;\n        --metadata-line-height: 1.4;\n        --metadata-margin-top: 20px;\n        --metadata-margin-bottom: 20px;\n        --list-margin-top: 20px;\n        --list-margin-bottom: 20px;\n        --orderedlist-margin-top: 20px;\n        --orderedlist-margin-bottom: 20px;\n        --postContent-margin-top: 20px;\n        --postContent-margin-bottom: 20px;\n        --theme-sheet-width-xl: 1140px;\n        --theme-sheet-width-lg: 940px;\n        --theme-sheet-width-md: 720px;\n        --theme-sheet-width-sm: 540px;\n        --theme-sheet-width-xs: 340px;\n        --hyperlink-color: var(--palette-1-base);\n        --hyperlink-alt-text-color: var(--palette-1-light-2);\n        --hyperlink-hover-color: var(--palette-1-base-darker);\n        --hyperlink-hover-alt-text-color: var(--grey-30-darker);\n        --form-input-border-width: 1px;\n        --form-input-border-color: var(--grey-30);\n        --form-input-borders: top right bottom left;\n        --form-input-background-color: var(--white);\n        --form-input-color: var(--black);\n        --h2-font-size-sm: 3rem;\n        --h2-font-weight-sm: 700;\n        --h2-line-height-sm: 1.2;\n        --h2-color-sm: var(--palette-5-dark-3);\n        --h2-list-icon-spacing-sm: 0.3;\n        --h2-list-icon-size-sm: 0.8;\n        --h2-font-size-xs: 2.25rem;\n        --h2-font-weight-xs: 700;\n        --h2-line-height-xs: 1.2;\n        --h2-color-xs: var(--palette-5-dark-3);\n        --h2-list-icon-spacing-xs: 0.3;\n        --h2-list-icon-size-xs: 0.8;\n        --text-font-size-xs: 1.125rem;\n        --text-line-height-xs: 2.2;\n        --text-list-icon-spacing-xs: 0.3;\n        --text-list-icon-size-xs: 0.8;\n        }\n\n        /** common-rules **/\n        h1.u-title\n        {\n        font-weight: var(--title-font-weight);\n        line-height: var(--title-line-height);\n        font-size: var(--title-font-size);\n        margin-top: var(--title-margin-top);\n        margin-bottom: var(--title-margin-bottom);\n        font-family: var(--title-font-family);\n        }\n        h2.u-subtitle\n        {\n        font-weight: var(--subtitle-font-weight);\n        line-height: var(--subtitle-line-height);\n        font-size: var(--subtitle-font-size);\n        margin-top: var(--subtitle-margin-top);\n        margin-bottom: var(--subtitle-margin-bottom);\n        }\n        h1:not(.u-title)\n        {\n        line-height: var(--h1-line-height);\n        font-size: var(--h1-font-size);\n        margin-top: var(--h1-margin-top);\n        margin-bottom: var(--h1-margin-bottom);\n        font-weight: var(--h1-font-weight);\n        list-icon-spacing: var(--h1-list-icon-spacing);\n        list-icon-size: var(--h1-list-icon-size);\n        }\n        h2:not(.u-subtitle)\n        {\n        font-weight: var(--h2-font-weight);\n        line-height: var(--h2-line-height);\n        font-size: var(--h2-font-size);\n        margin-top: var(--h2-margin-top);\n        margin-bottom: var(--h2-margin-bottom);\n        }\n        h3\n        {\n        line-height: var(--h3-line-height);\n        font-size: var(--h3-font-size);\n        margin-top: var(--h3-margin-top);\n        margin-bottom: var(--h3-margin-bottom);\n        text-transform: var(--h3-text-transform);\n        font-family: var(--h3-font-family);\n        letter-spacing: var(--h3-letter-spacing);\n        font-weight: var(--h3-font-weight);\n        }\n        h4\n        {\n        font-weight: var(--h4-font-weight);\n        line-height: var(--h4-line-height);\n        font-size: var(--h4-font-size);\n        margin-top: var(--h4-margin-top);\n        margin-bottom: var(--h4-margin-bottom);\n        }\n        h5\n        {\n        line-height: var(--h5-line-height);\n        font-size: var(--h5-font-size);\n        margin-top: var(--h5-margin-top);\n        margin-bottom: var(--h5-margin-bottom);\n        font-weight: var(--h5-font-weight);\n        list-icon-spacing: var(--h5-list-icon-spacing);\n        list-icon-size: var(--h5-list-icon-size);\n        font-family: var(--h5-font-family);\n        }\n        h6\n        {\n        font-weight: var(--h6-font-weight);\n        line-height: var(--h6-line-height);\n        font-size: var(--h6-font-size);\n        margin-top: var(--h6-margin-top);\n        margin-bottom: var(--h6-margin-bottom);\n        }\n        p.u-large-text\n        {\n        font-weight: var(--largeText-font-weight);\n        line-height: var(--largeText-line-height);\n        font-size: var(--largeText-font-size);\n        margin-top: var(--largeText-margin-top);\n        margin-bottom: var(--largeText-margin-bottom);\n        }\n        p:not(.u-text-variant)\n        {\n        line-height: var(--text-line-height);\n        font-size: var(--text-font-size);\n        margin-top: var(--text-margin-top);\n        margin-bottom: var(--text-margin-bottom);\n        font-family: var(--text-font-family);\n        list-icon-spacing: var(--text-list-icon-spacing);\n        list-icon-size: var(--text-list-icon-size);\n        }\n        p.u-small-text\n        {\n        font-weight: var(--smallText-font-weight);\n        line-height: var(--smallText-line-height);\n        font-size: var(--smallText-font-size);\n        margin-top: var(--smallText-margin-top);\n        margin-bottom: var(--smallText-margin-bottom);\n        }\n        .u-btn\n        {\n        letter-spacing: var(--button-letter-spacing);\n        font-size: var(--button-font-size);\n        line-height: var(--button-line-height);\n        margin-top: var(--button-margin-top);\n        margin-bottom: var(--button-margin-bottom);\n        text-transform: var(--button-text-transform);\n        border-top-style: var(--button-border-top-style);\n        border-left-style: var(--button-border-left-style);\n        border-right-style: var(--button-border-right-style);\n        border-bottom-style: var(--button-border-bottom-style);\n        borders: var(--button-borders);\n        border-radius: var(--button-border-radius);\n        image-size: var(--button-image-size);\n        image-fit: var(--button-image-fit);\n        image-zoom: var(--button-image-zoom);\n        animation: var(--button-animation);\n        }\n        .u-btn\n        {\n        border-radius: var(--button-border-radius);\n        }\n        blockquote\n        {\n        font-style: var(--blockquote-font-style);\n        line-height: var(--blockquote-line-height);\n        font-size: var(--blockquote-font-size);\n        padding-left: var(--blockquote-padding-left);\n        border-width: var(--blockquote-border-width);\n        margin-top: var(--blockquote-margin-top);\n        margin-bottom: var(--blockquote-margin-bottom);\n        border-style: var(--blockquote-border-style);\n        }\n        .u-metadata\n        {\n        font-size: var(--metadata-font-size);\n        line-height: var(--metadata-line-height);\n        margin-top: var(--metadata-margin-top);\n        margin-bottom: var(--metadata-margin-bottom);\n        }\n        ul:not(.u-unstyled)\n        {\n        margin-top: var(--list-margin-top);\n        margin-bottom: var(--list-margin-bottom);\n        }\n        ol\n        {\n        margin-top: var(--orderedlist-margin-top);\n        margin-bottom: var(--orderedlist-margin-bottom);\n        }\n        .u-post-content\n        {\n        margin-top: var(--postContent-margin-top);\n        margin-bottom: var(--postContent-margin-bottom);\n        }\n        .u-input\n        {\n        border-width: var(--form-input-border-width);\n        borders: var(--form-input-borders);\n        }\n        /** common-rules **/\n\n        /** publish-rules **/\n        /*begin-media rules*/\n        @media (max-width: 767px) {\n        h2:not(.u-subtitle)\n        {\n        font-size: var(--h2-font-size-sm);\n        font-weight: var(--h2-font-weight-sm);\n        line-height: var(--h2-line-height-sm);\n        color: var(--h2-color-sm);\n        list-icon-spacing: var(--h2-list-icon-spacing-sm);\n        list-icon-size: var(--h2-list-icon-size-sm);\n        }\n        }\n        @media (max-width: 575px) {\n        h2:not(.u-subtitle)\n        {\n        font-size: var(--h2-font-size-xs);\n        font-weight: var(--h2-font-weight-xs);\n        line-height: var(--h2-line-height-xs);\n        color: var(--h2-color-xs);\n        list-icon-spacing: var(--h2-list-icon-spacing-xs);\n        list-icon-size: var(--h2-list-icon-size-xs);\n        }\n        }\n        @media (max-width: 575px) {\n        p:not(.u-text-variant)\n        {\n        font-size: var(--text-font-size-xs);\n        line-height: var(--text-line-height-xs);\n        list-icon-spacing: var(--text-list-icon-spacing-xs);\n        list-icon-size: var(--text-list-icon-size-xs);\n        }\n        }\n        /*end-media rules*/\n        /** publish-rules **/\n\n        \n\n        /** cms-rules **/\n        /*begin-responsive rules*/\n        .u-sm h2:not(.u-subtitle)\n        {\n        font-weight: var(--h2-font-weight-sm);\n        line-height: var(--h2-line-height-sm);\n        font-size: var(--h2-font-size-sm);\n        }\n        .u-xs h2:not(.u-subtitle)\n        {\n        font-weight: var(--h2-font-weight-xs);\n        line-height: var(--h2-line-height-xs);\n        font-size: var(--h2-font-size-xs);\n        }\n        .u-xs p:not(.u-text-variant)\n        {\n        line-height: var(--text-line-height-xs);\n        font-size: var(--text-font-size-xs);\n        list-icon-spacing: var(--text-list-icon-spacing-xs);\n        list-icon-size: var(--text-list-icon-size-xs);\n        }\n        /*end-responsive rules*/\n        /** cms-rules **/\n\n        /** color-rules **/\n        .u-overlap.u-overlap-transparent:not(.u-overlap-contrast) .u-header :not(.u-nav-item) > h1.u-title,\n        .u-gradient > .u-container-layout > h1.u-title,\n        .u-image:not(.u-shading) > .u-container-layout > h1.u-title,\n        h1.u-title\n        {\n        color: var(--title-color);\n        }\n        .u-overlap.u-overlap-transparent:not(.u-overlap-contrast) .u-header :not(.u-nav-item) > h2.u-subtitle,\n        .u-gradient > .u-container-layout > h2.u-subtitle,\n        .u-image:not(.u-shading) > .u-container-layout > h2.u-subtitle,\n        h2.u-subtitle\n        {\n        color: var(--subtitle-color);\n        }\n        .u-overlap.u-overlap-transparent:not(.u-overlap-contrast) .u-header :not(.u-nav-item) > h1:not(.u-title),\n        .u-gradient > .u-container-layout > h1:not(.u-title),\n        .u-image:not(.u-shading) > .u-container-layout > h1:not(.u-title),\n        h1:not(.u-title)\n        {\n        color: var(--h1-color);\n        }\n        .u-overlap.u-overlap-transparent:not(.u-overlap-contrast) .u-header :not(.u-nav-item) > h2:not(.u-subtitle),\n        .u-gradient > .u-container-layout > h2:not(.u-subtitle),\n        .u-image:not(.u-shading) > .u-container-layout > h2:not(.u-subtitle),\n        h2:not(.u-subtitle)\n        {\n        color: var(--h2-color);\n        }\n        .u-overlap.u-overlap-transparent:not(.u-overlap-contrast) .u-header :not(.u-nav-item) > h3,\n        .u-gradient > .u-container-layout > h3,\n        .u-image:not(.u-shading) > .u-container-layout > h3,\n        h3\n        {\n        color: var(--h3-color);\n        }\n        .u-overlap.u-overlap-transparent:not(.u-overlap-contrast) .u-header :not(.u-nav-item) > h4,\n        .u-gradient > .u-container-layout > h4,\n        .u-image:not(.u-shading) > .u-container-layout > h4,\n        h4\n        {\n        color: var(--h4-color);\n        }\n        .u-overlap.u-overlap-transparent:not(.u-overlap-contrast) .u-header :not(.u-nav-item) > h5,\n        .u-gradient > .u-container-layout > h5,\n        .u-image:not(.u-shading) > .u-container-layout > h5,\n        h5\n        {\n        color: var(--h5-color);\n        }\n        .u-overlap.u-overlap-transparent:not(.u-overlap-contrast) .u-header :not(.u-nav-item) > h6,\n        .u-gradient > .u-container-layout > h6,\n        .u-image:not(.u-shading) > .u-container-layout > h6,\n        h6\n        {\n        color: var(--h6-color);\n        }\n        .u-overlap.u-overlap-transparent:not(.u-overlap-contrast) .u-header :not(.u-nav-item) > p.u-large-text,\n        .u-gradient > .u-container-layout > p.u-large-text,\n        .u-image:not(.u-shading) > .u-container-layout > p.u-large-text,\n        p.u-large-text\n        {\n        color: var(--largeText-color);\n        }\n        .u-overlap.u-overlap-transparent:not(.u-overlap-contrast) .u-header :not(.u-nav-item) > .u-btn,\n        .u-gradient > .u-container-layout > .u-btn,\n        .u-image:not(.u-shading) > .u-container-layout > .u-btn,\n        .u-btn\n        {\n        background-color: var(--button-background-color);\n        color: var(--button-color);\n        }\n        .u-overlap.u-overlap-transparent:not(.u-overlap-contrast) .u-header :not(.u-nav-item) > .u-btn:hover,\n        .u-gradient > .u-container-layout > .u-btn:hover,\n        .u-image:not(.u-shading) > .u-container-layout > .u-btn:hover,\n        .u-btn:hover\n        {\n        background-color: var(--button-hover-background-color);\n        color: var(--button-hover-color);\n        }\n        .u-overlap.u-overlap-transparent:not(.u-overlap-contrast) .u-header :not(.u-nav-item) > .u-btn:focus,\n        .u-gradient > .u-container-layout > .u-btn:focus,\n        .u-image:not(.u-shading) > .u-container-layout > .u-btn:focus,\n        .u-btn:focus\n        {\n        background-color: var(--button-hover-background-color);\n        color: var(--button-hover-color);\n        }\n        .u-overlap.u-overlap-transparent:not(.u-overlap-contrast) .u-header :not(.u-nav-item) > .u-btn:active,\n        .u-gradient > .u-container-layout > .u-btn:active,\n        .u-image:not(.u-shading) > .u-container-layout > .u-btn:active,\n        .u-btn:active\n        {\n        background-color: var(--button-active-background-color);\n        color: var(--button-active-color);\n        }\n        .u-overlap.u-overlap-transparent:not(.u-overlap-contrast) .u-header :not(.u-nav-item) > blockquote,\n        .u-gradient > .u-container-layout > blockquote,\n        .u-image:not(.u-shading) > .u-container-layout > blockquote,\n        blockquote\n        {\n        border-color: var(--blockquote-border-color);\n        }\n        .u-overlap.u-overlap-transparent:not(.u-overlap-contrast) .u-header :not(.u-nav-item) > a,\n        .u-gradient > .u-container-layout > a,\n        .u-image:not(.u-shading) > .u-container-layout > a,\n        a\n        {\n        color: var(--hyperlink-color);\n        }\n        .u-overlap.u-overlap-transparent:not(.u-overlap-contrast) .u-header :not(.u-nav-item) > a:hover,\n        .u-gradient > .u-container-layout > a:hover,\n        .u-image:not(.u-shading) > .u-container-layout > a:hover,\n        a:hover\n        {\n        color: var(--hyperlink-hover-color);\n        }\n        .u-overlap.u-overlap-transparent:not(.u-overlap-contrast) .u-header :not(.u-nav-item) > .u-input,\n        .u-gradient > .u-container-layout > .u-input,\n        .u-image:not(.u-shading) > .u-container-layout > .u-input,\n        .u-input\n        {\n        border-color: var(--form-input-border-color);\n        background-color: var(--form-input-background-color);\n        color: var(--form-input-color);\n        }\n        /** color-rules **/\n\n        /** alt-color-rules **/\n        .u-body-color h1.u-title,.u-palette-1-base h1.u-title,.u-palette-1-dark-3 h1.u-title,.u-palette-1-dark-2 h1.u-title,.u-palette-1-dark-1 h1.u-title,.u-palette-1 h1.u-title,.u-palette-2-base h1.u-title,.u-palette-2-dark-3 h1.u-title,.u-palette-2-dark-2 h1.u-title,.u-palette-2-dark-1 h1.u-title,.u-palette-2 h1.u-title,.u-palette-2-light-1 h1.u-title,.u-palette-3-dark-3 h1.u-title,.u-palette-3-dark-2 h1.u-title,.u-palette-3-dark-1 h1.u-title,.u-palette-4-dark-3 h1.u-title,.u-palette-4-dark-2 h1.u-title,.u-palette-4-dark-1 h1.u-title,.u-palette-4 h1.u-title,.u-palette-5-dark-3 h1.u-title,.u-palette-5-dark-2 h1.u-title,.u-palette-5-dark-1 h1.u-title,.u-palette-5 h1.u-title,.u-grey-40 h1.u-title,.u-grey-30 h1.u-title,.u-grey-90 h1.u-title,.u-grey-80 h1.u-title,.u-grey-75 h1.u-title,.u-black h1.u-title,.u-grey-70 h1.u-title,.u-grey-60 h1.u-title,.u-grey-50 h1.u-title,.u-grey-dark-3 h1.u-title,.u-grey-dark-2 h1.u-title,.u-grey-dark-1 h1.u-title,.u-grey h1.u-title,.u-shading h1.u-title,.u-overlap-contrast .u-header h1.u-title:not(.u-nav-link):not(.u-btn)\n        {\n        color: var(--title-alt-text-color);\n        }\n        .u-body-color h2.u-subtitle,.u-palette-1-base h2.u-subtitle,.u-palette-1-dark-3 h2.u-subtitle,.u-palette-1-dark-2 h2.u-subtitle,.u-palette-1-dark-1 h2.u-subtitle,.u-palette-1 h2.u-subtitle,.u-palette-2-base h2.u-subtitle,.u-palette-2-dark-3 h2.u-subtitle,.u-palette-2-dark-2 h2.u-subtitle,.u-palette-2-dark-1 h2.u-subtitle,.u-palette-2 h2.u-subtitle,.u-palette-2-light-1 h2.u-subtitle,.u-palette-3-dark-3 h2.u-subtitle,.u-palette-3-dark-2 h2.u-subtitle,.u-palette-3-dark-1 h2.u-subtitle,.u-palette-4-dark-3 h2.u-subtitle,.u-palette-4-dark-2 h2.u-subtitle,.u-palette-4-dark-1 h2.u-subtitle,.u-palette-4 h2.u-subtitle,.u-palette-5-dark-3 h2.u-subtitle,.u-palette-5-dark-2 h2.u-subtitle,.u-palette-5-dark-1 h2.u-subtitle,.u-palette-5 h2.u-subtitle,.u-grey-40 h2.u-subtitle,.u-grey-30 h2.u-subtitle,.u-grey-90 h2.u-subtitle,.u-grey-80 h2.u-subtitle,.u-grey-75 h2.u-subtitle,.u-black h2.u-subtitle,.u-grey-70 h2.u-subtitle,.u-grey-60 h2.u-subtitle,.u-grey-50 h2.u-subtitle,.u-grey-dark-3 h2.u-subtitle,.u-grey-dark-2 h2.u-subtitle,.u-grey-dark-1 h2.u-subtitle,.u-grey h2.u-subtitle,.u-shading h2.u-subtitle,.u-overlap-contrast .u-header h2.u-subtitle:not(.u-nav-link):not(.u-btn)\n        {\n        color: var(--subtitle-alt-text-color);\n        }\n        .u-body-color h1:not(.u-title),.u-palette-1-base h1:not(.u-title),.u-palette-1-dark-3 h1:not(.u-title),.u-palette-1-dark-2 h1:not(.u-title),.u-palette-1-dark-1 h1:not(.u-title),.u-palette-1 h1:not(.u-title),.u-palette-2-base h1:not(.u-title),.u-palette-2-dark-3 h1:not(.u-title),.u-palette-2-dark-2 h1:not(.u-title),.u-palette-2-dark-1 h1:not(.u-title),.u-palette-2 h1:not(.u-title),.u-palette-2-light-1 h1:not(.u-title),.u-palette-3-dark-3 h1:not(.u-title),.u-palette-3-dark-2 h1:not(.u-title),.u-palette-3-dark-1 h1:not(.u-title),.u-palette-4-dark-3 h1:not(.u-title),.u-palette-4-dark-2 h1:not(.u-title),.u-palette-4-dark-1 h1:not(.u-title),.u-palette-4 h1:not(.u-title),.u-palette-5-dark-3 h1:not(.u-title),.u-palette-5-dark-2 h1:not(.u-title),.u-palette-5-dark-1 h1:not(.u-title),.u-palette-5 h1:not(.u-title),.u-grey-40 h1:not(.u-title),.u-grey-30 h1:not(.u-title),.u-grey-90 h1:not(.u-title),.u-grey-80 h1:not(.u-title),.u-grey-75 h1:not(.u-title),.u-black h1:not(.u-title),.u-grey-70 h1:not(.u-title),.u-grey-60 h1:not(.u-title),.u-grey-50 h1:not(.u-title),.u-grey-dark-3 h1:not(.u-title),.u-grey-dark-2 h1:not(.u-title),.u-grey-dark-1 h1:not(.u-title),.u-grey h1:not(.u-title),.u-shading h1:not(.u-title),.u-overlap-contrast .u-header h1:not(.u-title):not(.u-nav-link):not(.u-btn)\n        {\n        color: var(--h1-alt-text-color);\n        }\n        .u-body-color h2:not(.u-subtitle),.u-palette-1-base h2:not(.u-subtitle),.u-palette-1-dark-3 h2:not(.u-subtitle),.u-palette-1-dark-2 h2:not(.u-subtitle),.u-palette-1-dark-1 h2:not(.u-subtitle),.u-palette-1 h2:not(.u-subtitle),.u-palette-2-base h2:not(.u-subtitle),.u-palette-2-dark-3 h2:not(.u-subtitle),.u-palette-2-dark-2 h2:not(.u-subtitle),.u-palette-2-dark-1 h2:not(.u-subtitle),.u-palette-2 h2:not(.u-subtitle),.u-palette-2-light-1 h2:not(.u-subtitle),.u-palette-3-dark-3 h2:not(.u-subtitle),.u-palette-3-dark-2 h2:not(.u-subtitle),.u-palette-3-dark-1 h2:not(.u-subtitle),.u-palette-4-dark-3 h2:not(.u-subtitle),.u-palette-4-dark-2 h2:not(.u-subtitle),.u-palette-4-dark-1 h2:not(.u-subtitle),.u-palette-4 h2:not(.u-subtitle),.u-palette-5-dark-3 h2:not(.u-subtitle),.u-palette-5-dark-2 h2:not(.u-subtitle),.u-palette-5-dark-1 h2:not(.u-subtitle),.u-palette-5 h2:not(.u-subtitle),.u-grey-40 h2:not(.u-subtitle),.u-grey-30 h2:not(.u-subtitle),.u-grey-90 h2:not(.u-subtitle),.u-grey-80 h2:not(.u-subtitle),.u-grey-75 h2:not(.u-subtitle),.u-black h2:not(.u-subtitle),.u-grey-70 h2:not(.u-subtitle),.u-grey-60 h2:not(.u-subtitle),.u-grey-50 h2:not(.u-subtitle),.u-grey-dark-3 h2:not(.u-subtitle),.u-grey-dark-2 h2:not(.u-subtitle),.u-grey-dark-1 h2:not(.u-subtitle),.u-grey h2:not(.u-subtitle),.u-shading h2:not(.u-subtitle),.u-overlap-contrast .u-header h2:not(.u-subtitle):not(.u-nav-link):not(.u-btn)\n        {\n        color: var(--h2-alt-text-color);\n        }\n        .u-body-color h3,.u-palette-1-base h3,.u-palette-1-dark-3 h3,.u-palette-1-dark-2 h3,.u-palette-1-dark-1 h3,.u-palette-1 h3,.u-palette-2-base h3,.u-palette-2-dark-3 h3,.u-palette-2-dark-2 h3,.u-palette-2-dark-1 h3,.u-palette-2 h3,.u-palette-2-light-1 h3,.u-palette-3-dark-3 h3,.u-palette-3-dark-2 h3,.u-palette-3-dark-1 h3,.u-palette-4-dark-3 h3,.u-palette-4-dark-2 h3,.u-palette-4-dark-1 h3,.u-palette-4 h3,.u-palette-5-dark-3 h3,.u-palette-5-dark-2 h3,.u-palette-5-dark-1 h3,.u-palette-5 h3,.u-grey-40 h3,.u-grey-30 h3,.u-grey-90 h3,.u-grey-80 h3,.u-grey-75 h3,.u-black h3,.u-grey-70 h3,.u-grey-60 h3,.u-grey-50 h3,.u-grey-dark-3 h3,.u-grey-dark-2 h3,.u-grey-dark-1 h3,.u-grey h3,.u-shading h3,.u-overlap-contrast .u-header h3:not(.u-nav-link):not(.u-btn)\n        {\n        color: var(--h3-alt-text-color);\n        }\n        .u-body-color h4,.u-palette-1-base h4,.u-palette-1-dark-3 h4,.u-palette-1-dark-2 h4,.u-palette-1-dark-1 h4,.u-palette-1 h4,.u-palette-2-base h4,.u-palette-2-dark-3 h4,.u-palette-2-dark-2 h4,.u-palette-2-dark-1 h4,.u-palette-2 h4,.u-palette-2-light-1 h4,.u-palette-3-dark-3 h4,.u-palette-3-dark-2 h4,.u-palette-3-dark-1 h4,.u-palette-4-dark-3 h4,.u-palette-4-dark-2 h4,.u-palette-4-dark-1 h4,.u-palette-4 h4,.u-palette-5-dark-3 h4,.u-palette-5-dark-2 h4,.u-palette-5-dark-1 h4,.u-palette-5 h4,.u-grey-40 h4,.u-grey-30 h4,.u-grey-90 h4,.u-grey-80 h4,.u-grey-75 h4,.u-black h4,.u-grey-70 h4,.u-grey-60 h4,.u-grey-50 h4,.u-grey-dark-3 h4,.u-grey-dark-2 h4,.u-grey-dark-1 h4,.u-grey h4,.u-shading h4,.u-overlap-contrast .u-header h4:not(.u-nav-link):not(.u-btn)\n        {\n        color: var(--h4-alt-text-color);\n        }\n        .u-body-color h5,.u-palette-1-base h5,.u-palette-1-dark-3 h5,.u-palette-1-dark-2 h5,.u-palette-1-dark-1 h5,.u-palette-1 h5,.u-palette-2-base h5,.u-palette-2-dark-3 h5,.u-palette-2-dark-2 h5,.u-palette-2-dark-1 h5,.u-palette-2 h5,.u-palette-2-light-1 h5,.u-palette-3-dark-3 h5,.u-palette-3-dark-2 h5,.u-palette-3-dark-1 h5,.u-palette-4-dark-3 h5,.u-palette-4-dark-2 h5,.u-palette-4-dark-1 h5,.u-palette-4 h5,.u-palette-5-dark-3 h5,.u-palette-5-dark-2 h5,.u-palette-5-dark-1 h5,.u-palette-5 h5,.u-grey-40 h5,.u-grey-30 h5,.u-grey-90 h5,.u-grey-80 h5,.u-grey-75 h5,.u-black h5,.u-grey-70 h5,.u-grey-60 h5,.u-grey-50 h5,.u-grey-dark-3 h5,.u-grey-dark-2 h5,.u-grey-dark-1 h5,.u-grey h5,.u-shading h5,.u-overlap-contrast .u-header h5:not(.u-nav-link):not(.u-btn)\n        {\n        color: var(--h5-alt-text-color);\n        }\n        .u-body-color h6,.u-palette-1-base h6,.u-palette-1-dark-3 h6,.u-palette-1-dark-2 h6,.u-palette-1-dark-1 h6,.u-palette-1 h6,.u-palette-2-base h6,.u-palette-2-dark-3 h6,.u-palette-2-dark-2 h6,.u-palette-2-dark-1 h6,.u-palette-2 h6,.u-palette-2-light-1 h6,.u-palette-3-dark-3 h6,.u-palette-3-dark-2 h6,.u-palette-3-dark-1 h6,.u-palette-4-dark-3 h6,.u-palette-4-dark-2 h6,.u-palette-4-dark-1 h6,.u-palette-4 h6,.u-palette-5-dark-3 h6,.u-palette-5-dark-2 h6,.u-palette-5-dark-1 h6,.u-palette-5 h6,.u-grey-40 h6,.u-grey-30 h6,.u-grey-90 h6,.u-grey-80 h6,.u-grey-75 h6,.u-black h6,.u-grey-70 h6,.u-grey-60 h6,.u-grey-50 h6,.u-grey-dark-3 h6,.u-grey-dark-2 h6,.u-grey-dark-1 h6,.u-grey h6,.u-shading h6,.u-overlap-contrast .u-header h6:not(.u-nav-link):not(.u-btn)\n        {\n        color: var(--h6-alt-text-color);\n        }\n        .u-body-color p.u-large-text,.u-palette-1-base p.u-large-text,.u-palette-1-dark-3 p.u-large-text,.u-palette-1-dark-2 p.u-large-text,.u-palette-1-dark-1 p.u-large-text,.u-palette-1 p.u-large-text,.u-palette-2-base p.u-large-text,.u-palette-2-dark-3 p.u-large-text,.u-palette-2-dark-2 p.u-large-text,.u-palette-2-dark-1 p.u-large-text,.u-palette-2 p.u-large-text,.u-palette-2-light-1 p.u-large-text,.u-palette-3-dark-3 p.u-large-text,.u-palette-3-dark-2 p.u-large-text,.u-palette-3-dark-1 p.u-large-text,.u-palette-4-dark-3 p.u-large-text,.u-palette-4-dark-2 p.u-large-text,.u-palette-4-dark-1 p.u-large-text,.u-palette-4 p.u-large-text,.u-palette-5-dark-3 p.u-large-text,.u-palette-5-dark-2 p.u-large-text,.u-palette-5-dark-1 p.u-large-text,.u-palette-5 p.u-large-text,.u-grey-40 p.u-large-text,.u-grey-30 p.u-large-text,.u-grey-90 p.u-large-text,.u-grey-80 p.u-large-text,.u-grey-75 p.u-large-text,.u-black p.u-large-text,.u-grey-70 p.u-large-text,.u-grey-60 p.u-large-text,.u-grey-50 p.u-large-text,.u-grey-dark-3 p.u-large-text,.u-grey-dark-2 p.u-large-text,.u-grey-dark-1 p.u-large-text,.u-grey p.u-large-text,.u-shading p.u-large-text,.u-overlap-contrast .u-header p.u-large-text:not(.u-nav-link):not(.u-btn)\n        {\n        color: var(--largeText-alt-text-color);\n        }\n        .u-body-color .u-btn,.u-palette-1-base .u-btn,.u-palette-1-dark-3 .u-btn,.u-palette-1-dark-2 .u-btn,.u-palette-1-dark-1 .u-btn,.u-palette-1 .u-btn,.u-palette-2-base .u-btn,.u-palette-2-dark-3 .u-btn,.u-palette-2-dark-2 .u-btn,.u-palette-2-dark-1 .u-btn,.u-palette-2 .u-btn,.u-palette-2-light-1 .u-btn,.u-palette-3-dark-3 .u-btn,.u-palette-3-dark-2 .u-btn,.u-palette-3-dark-1 .u-btn,.u-palette-4-dark-3 .u-btn,.u-palette-4-dark-2 .u-btn,.u-palette-4-dark-1 .u-btn,.u-palette-4 .u-btn,.u-palette-5-dark-3 .u-btn,.u-palette-5-dark-2 .u-btn,.u-palette-5-dark-1 .u-btn,.u-palette-5 .u-btn,.u-grey-40 .u-btn,.u-grey-30 .u-btn,.u-grey-90 .u-btn,.u-grey-80 .u-btn,.u-grey-75 .u-btn,.u-black .u-btn,.u-grey-70 .u-btn,.u-grey-60 .u-btn,.u-grey-50 .u-btn,.u-grey-dark-3 .u-btn,.u-grey-dark-2 .u-btn,.u-grey-dark-1 .u-btn,.u-grey .u-btn,.u-shading .u-btn,.u-overlap-contrast .u-header .u-btn\n        {\n        background-color: var(--button-alt-background-color);\n        color: var(--button-alt-color);\n        }\n        .u-body-color .u-btn:hover,.u-palette-1-base .u-btn:hover,.u-palette-1-dark-3 .u-btn:hover,.u-palette-1-dark-2 .u-btn:hover,.u-palette-1-dark-1 .u-btn:hover,.u-palette-1 .u-btn:hover,.u-palette-2-base .u-btn:hover,.u-palette-2-dark-3 .u-btn:hover,.u-palette-2-dark-2 .u-btn:hover,.u-palette-2-dark-1 .u-btn:hover,.u-palette-2 .u-btn:hover,.u-palette-2-light-1 .u-btn:hover,.u-palette-3-dark-3 .u-btn:hover,.u-palette-3-dark-2 .u-btn:hover,.u-palette-3-dark-1 .u-btn:hover,.u-palette-4-dark-3 .u-btn:hover,.u-palette-4-dark-2 .u-btn:hover,.u-palette-4-dark-1 .u-btn:hover,.u-palette-4 .u-btn:hover,.u-palette-5-dark-3 .u-btn:hover,.u-palette-5-dark-2 .u-btn:hover,.u-palette-5-dark-1 .u-btn:hover,.u-palette-5 .u-btn:hover,.u-grey-40 .u-btn:hover,.u-grey-30 .u-btn:hover,.u-grey-90 .u-btn:hover,.u-grey-80 .u-btn:hover,.u-grey-75 .u-btn:hover,.u-black .u-btn:hover,.u-grey-70 .u-btn:hover,.u-grey-60 .u-btn:hover,.u-grey-50 .u-btn:hover,.u-grey-dark-3 .u-btn:hover,.u-grey-dark-2 .u-btn:hover,.u-grey-dark-1 .u-btn:hover,.u-grey .u-btn:hover,.u-shading .u-btn:hover,.u-overlap-contrast .u-header .u-btn:hover\n        {\n        background-color: var(--button-hover-alt-background-color);\n        color: var(--button-hover-alt-color);\n        }\n        .u-body-color .u-btn:active,.u-palette-1-base .u-btn:active,.u-palette-1-dark-3 .u-btn:active,.u-palette-1-dark-2 .u-btn:active,.u-palette-1-dark-1 .u-btn:active,.u-palette-1 .u-btn:active,.u-palette-2-base .u-btn:active,.u-palette-2-dark-3 .u-btn:active,.u-palette-2-dark-2 .u-btn:active,.u-palette-2-dark-1 .u-btn:active,.u-palette-2 .u-btn:active,.u-palette-2-light-1 .u-btn:active,.u-palette-3-dark-3 .u-btn:active,.u-palette-3-dark-2 .u-btn:active,.u-palette-3-dark-1 .u-btn:active,.u-palette-4-dark-3 .u-btn:active,.u-palette-4-dark-2 .u-btn:active,.u-palette-4-dark-1 .u-btn:active,.u-palette-4 .u-btn:active,.u-palette-5-dark-3 .u-btn:active,.u-palette-5-dark-2 .u-btn:active,.u-palette-5-dark-1 .u-btn:active,.u-palette-5 .u-btn:active,.u-grey-40 .u-btn:active,.u-grey-30 .u-btn:active,.u-grey-90 .u-btn:active,.u-grey-80 .u-btn:active,.u-grey-75 .u-btn:active,.u-black .u-btn:active,.u-grey-70 .u-btn:active,.u-grey-60 .u-btn:active,.u-grey-50 .u-btn:active,.u-grey-dark-3 .u-btn:active,.u-grey-dark-2 .u-btn:active,.u-grey-dark-1 .u-btn:active,.u-grey .u-btn:active,.u-shading .u-btn:active,.u-overlap-contrast .u-header .u-btn:active\n        {\n        background-color: var(--button-active-alt-background-color);\n        color: var(--button-active-alt-color);\n        }\n        .u-body-color a,.u-palette-1-base a,.u-palette-1-dark-3 a,.u-palette-1-dark-2 a,.u-palette-1-dark-1 a,.u-palette-1 a,.u-palette-2-base a,.u-palette-2-dark-3 a,.u-palette-2-dark-2 a,.u-palette-2-dark-1 a,.u-palette-2 a,.u-palette-2-light-1 a,.u-palette-3-dark-3 a,.u-palette-3-dark-2 a,.u-palette-3-dark-1 a,.u-palette-4-dark-3 a,.u-palette-4-dark-2 a,.u-palette-4-dark-1 a,.u-palette-4 a,.u-palette-5-dark-3 a,.u-palette-5-dark-2 a,.u-palette-5-dark-1 a,.u-palette-5 a,.u-grey-40 a,.u-grey-30 a,.u-grey-90 a,.u-grey-80 a,.u-grey-75 a,.u-black a,.u-grey-70 a,.u-grey-60 a,.u-grey-50 a,.u-grey-dark-3 a,.u-grey-dark-2 a,.u-grey-dark-1 a,.u-grey a,.u-shading a,.u-overlap-contrast .u-header a:not(.u-nav-link):not(.u-btn)\n        {\n        color: var(--hyperlink-alt-text-color);\n        }\n        .u-body-color a:hover,.u-palette-1-base a:hover,.u-palette-1-dark-3 a:hover,.u-palette-1-dark-2 a:hover,.u-palette-1-dark-1 a:hover,.u-palette-1 a:hover,.u-palette-2-base a:hover,.u-palette-2-dark-3 a:hover,.u-palette-2-dark-2 a:hover,.u-palette-2-dark-1 a:hover,.u-palette-2 a:hover,.u-palette-2-light-1 a:hover,.u-palette-3-dark-3 a:hover,.u-palette-3-dark-2 a:hover,.u-palette-3-dark-1 a:hover,.u-palette-4-dark-3 a:hover,.u-palette-4-dark-2 a:hover,.u-palette-4-dark-1 a:hover,.u-palette-4 a:hover,.u-palette-5-dark-3 a:hover,.u-palette-5-dark-2 a:hover,.u-palette-5-dark-1 a:hover,.u-palette-5 a:hover,.u-grey-40 a:hover,.u-grey-30 a:hover,.u-grey-90 a:hover,.u-grey-80 a:hover,.u-grey-75 a:hover,.u-black a:hover,.u-grey-70 a:hover,.u-grey-60 a:hover,.u-grey-50 a:hover,.u-grey-dark-3 a:hover,.u-grey-dark-2 a:hover,.u-grey-dark-1 a:hover,.u-grey a:hover\n        {\n        color: var(--hyperlink-hover-alt-text-color);\n        }\n        /** alt-color-rules **/\n    </style><style id=\"font-scheme\" font-scheme=\"custom-font-family-3\" heading-font=\"'Playfair Display',serif\" text-font=\"'Open Sans',sans-serif\">.u-body {\n   --text-font: 'Open Sans',sans-serif;\n   --heading-font: 'Playfair Display',serif;\n}</style>","appVersion":"6.9.2","publicUrl":null,"customDomainUrl":null,"subDomain":null,"datePublished":null,"isTrial":true,"serverSiteId":null}
